title,url,date,content,thumbnail,celebrity
"Han So-hee, Ryu Joon-yeol part ways 2 weeks after going public with relationship",https://www.koreaherald.com/article/3357292,2024.03.31 13:37,"South Korean actors Han So-hee and Ryu Joon-yeol have decided to “go their own ways” after two tumultuous weeks surrounding the stars’ admissions of dating and accusations of impropriety in Ryu dating Han so soon after his breakup from his longtime partner, singer and actor Hyeri. Ryu and Han’s breakup surfaced Saturday night when Han uploaded a 2001 photo of Nicole Kidman that had been taken by paparazzi as she walked out of the court following her divorce from Tom Cruise. The photo has popularly been used to express feelings of freedom and liberation after ending a relationship. Ryu’s agency C-JeS Studio shortly after confirmed “the two have separated.” Han’s agency, 9ato Entertainment, commented to a local media outlet that the two ended their relationship after they “realized that their roles as actors were larger than simply exhausting emotions between the two.” “They promised not to waste energy and emotions on personal stories,” the agency said in explaining the reason behind the breakup. Han’s agency also apologized for “not being able to take care of the artist well,” admitting that Han’s way of communication had been “wrong.” On March 16, Han wrote on her blog that she had started dating Ryu in early 2024 after he had ended his relationship with Hyeri in 2023. The blog post was just a few days after the new lovebirds were spotted at a hotel in Hawaii together. But news reports surfaced that the two had been acquainted since November last year, around the same time Ryu was reported to have ended his seven-year relationship with Hyeri, igniting rumors that Ryu may have “transferred” to Han from Hyeri. A ""transfer"" in terms of dating is used in Korean to describe one moving from one romantic partner to another with no or minimal time between the two relationships, likening the act to switching subway lines or buses on one's daily commute. As accusations grew around Ryu and Han, Han stepped in to actively defend herself and Ryu, saying in a social media post that she’s “not a person who likes someone with a girlfriend, or allows him to like (her) while being a ‘friend,’ or becomes interested and gives meaning to a relationship with someone with a girlfriend.” Han added that she doesn’t “interfere” with other couple’s relationships, although she is a fan of the TV program “Exchange” -- referring to the reality dating show where former couples live in the same house and decide whether they want to get back together or move in with new people. This led Hyeri to officially release a statement that she had not met Ryu again after November – the month in which Han insisted that Ryu and Hyeri broke up. But Hyeri did not specify the time of her split from Ryu. The post has since been removed. Meanwhile, Ryu and Han were recently linked to possible participation in director Han Jae-rim’s new project, “Delusion,” an adaptation of a famous webtoon of the same title.",https://wimg.heraldcorp.com/content/default/2024/03/31/20240331050091_0.jpg?type=h&h=240,hansohee
'Transfer dating': Why dating without gap touches a nerve in Korea,https://www.koreaherald.com/article/3353178,2024.03.21 12:34,"Accusation of Ryu Jun-yeol's quick 'transfer' from Hyeri to Han So-hee evokes ill feelings Actors Ryu Jun-yeol and Han So-hee, newly announced lovebirds in the South Korean entertainment scene, recently vowed legal action against a barrage of what they say are malicious comments targeting their romance. In just three months, Han in particular went from being voted ""female celebrity most people want to spend Christmas with"" to losing endorsement deals. The mere accusation of ""hwanseung yeonae"" -- which roughly translates to ""transferring between dating partners"" -- can be damaging to celebrities whose careers depend on the public's affection for them. It was recently reported that Lotte Chilsung Beverage did not renew its marketing partnership with Han after it expired this month, and Nonghyup Bank did the same. Secondhand car sales platform Hey Dealer closed the comment section of its YouTube ad featuring the actor due to malicious comments against her. Fallout concerning Ryu -- the man at the center accused of the ""quick transfer"" -- has yet to significantly materialize beyond harsh online comments. It was reported Wednesday that multiple supporters of Greenpeace Korea have requested the organization drop him as an official ambassador. Greenpeace Korea told local daily Kukmin Ilbo that it is looking into the requests, adding it would ""do our best to find better ways to promote our campaigns.” Yet by nearly all indications, the love life of former media darling Han has led to her suddenly falling out of the public's favor. Actors embroiled in controversy Hwanseung yeonae is loosely defined among South Koreans as moving on from one romantic partner to another with no or minimal time between the relationships, likening the act to transferring between buses or subway trains on one's daily commute. The relatively short period between Ryu's relationship with Han and the termination of his prior relationship with singer and actor Hyeri, reported in November, resulted in the new couple being suspected of the detested form of dating. Last week, Han and Ryu were reported to be spotted at a hotel in Hawaii together, leading them to promptly admit to being in a romantic relationship. But reports have since showed that the two had been acquainted since November of last year, around the same time Ryu was reported to have ended his seven-year relationship with Hyeri. Upon reports of her ex-boyfriend's new girlfriend, Hyeri unfollowed Ryu on Instagram and cryptically wrote ""That's funny"" on her page. Han then apparently responded on her own Instagram page, ""That's funny, for me too,"" saying she does not fall for anyone who is dating someone else. Both posts have since been removed. Upon public scrutiny that followed, Han issued an official statement saying that she started dating Ryu early this year, and his relationship with Hyeri had actually ended early last year. She urged the public not to use the word ""hwanseung,"" admitting that she was irked by the accusation. On Monday, Hyeri wrote in an official statement that she and Ryu talked about ""discussing the matter further"" after reports of them going their separate ways emerged in November. She offered an apology for what she said was an emotional response, vowing to be more prudent in her actions and words. While Hyeri did not specify exactly when her relationship with Ryu ended, she added that she did not actually meet with Ryu again after November. By the admissions of both parties, it does not appear that Ryu's relationships with the two women overlapped, although many in the South Korean public still believe he should have taken more time before moving on out of respect for his long-term romantic partner. Why people get offended by 'transfer relationships' Surveys indicate that most South Koreans believe people should take some personal time between romantic relationships -- though the terms of that time and how long it should extend remain elusive. Matchmaking company Duo conducted a survey on 197 men and 215 women, in which 76 percent of respondents agreed that there does ""need to be a gap between romantic relationships."" Of the respondents, 40.3 percent said ""people need time to process their feelings about previous relationship,"" and 22.8 percent cited ""there are manners (for the other person) when breaking up."" When one's former romantic partner immediately started dating another person, 52.9 percent said they suspected hwanseung yeonae. An October survey by matchmaking company Gayeon with 217 men and 111 women showed that 57.1 percent of respondents thought ""I've fallen for another person"" was the worst comment possible in a breakup. It also showed that 35.1 percent thought the other person ""transferring"" to a new relationship was the most baffling situation when breaking up. Being accused of hwanseung yeonae can be detrimental to one's social life as well. A 27-year-old woman surnamed Kang said she once became embroiled in such a complicated relationship while attending university in the US. Her boyfriend had been involved in an on-again, off-again relationship with his previous partner, who had thought they were only on a temporary break. The boyfriend, who thought they were broken up for good, went on to date Kang. The incident led to her friends pointing fingers and casting her out of the social group, accusing her of impropriety. As in the case of Kang, many incidents of hwanseung yeonae occur when two people are not on the same page in their relationship. Han Won-jeong, a manager for Gayeon, explained that much of the friction in a breakup derives from two people having different feelings toward each other. ""When the two people's stance (toward the relationship) is not the same, breaking up can be more difficult. A breakup involving a third party can be more shocking, but it could also lead to him or her letting go more quickly,"" Han said. For many people, the reason they take issue with hwanseung yeonae is that they suspect the foundation for the new relationship had been laid in the ruins of the previous relationship, even if the person did not cheat outright. This, they believe, shows a lack of respect for a person they once claimed to care for. “When my boyfriend starts dating immediately after we’ve broken up, I have to wonder if that relationship hadn’t already been started,” said 32-year-old Kim Hee-won, who experienced what she suspected was a “transfer” on her ex-boyfriend’s part. “When you end a relationship, particularly one that has continued for years, I think it takes some time to recover. Not needing such recovery time leads me to suspect that the relationship wasn’t so devoted after all.”",https://wimg.heraldcorp.com/content/default/2024/03/21/20240321050519_0.jpg?type=h&h=240,hansohee
"Ryu Joon-yeol, Han So-hee confirm dating since early 2024",https://www.koreaherald.com/article/3349806,2024.03.17 14:51,"The admission by South Korean actors Ryu Joon-yeol and Han So-hee Saturday that they have been in a relationship since early this year has led to mixed reactions from the public, with some speculating that Ryu had met Han before breaking up with Hyeri, a popular singer-turned-actor. Ryu and Hyeri starred in the hit 2015 TVN drama “Reply 1988” and began dating in 2017. Han wrote on her blog on Saturday that she started dating Ryu after he had ended his relationship with Hyeri. “The two broke up in early 2023 and the news about their parting first came out in November,” she wrote. In a separate comment, she added that she did not personally hear about the exact date of Ryu's breakup with his ex, but she guessed as much based on an article published in June 2023. At the end of the blog post, Han also wrote that she would like to apologize to Hyeri, regarding the comments she uploaded on her Instagram story. In the story Han uploaded earlier, she said that she’s “not a person who likes someone with a girlfriend, or allows him to like (her) while being a ‘friend,’ or become interested and give meaning to a relationship with someone with a girlfriend.” She added that she doesn’t “interfere” with other couple’s relationships, although she is a fan of the TV program “Exchange” – referring to the reality dating show where former couples live in the same house and decide whether they want to get back together or move in with new people. “It’s very interesting for me as well,” Han also wrote, a sarcastic comment targeting Hyeri, who earlier uploaded a post on her personal social media account which said “it’s very interesting,” after the news came out that Ryu and Han were spotted together in Hawaii. Ryu’s agency C-JeS Studio said in a statement that Ryu and Han met after he broke up with Hyeri. “We would like to ask for your understanding once again as his personal rights have been seriously violated with unnecessary misunderstandings and speculations over the past couple of days just because we did not confirm his relationship status,"" the statement said. The agency also vowed to take legal action against malicious comments and insulting posts. Meanwhile, it had been reported earlier that Ryu and Han were reviewing possible participation in director Han Jae-rim’s new project “Delusion” (direct translation), an adaptation of a famous webtoon of the same title.",https://wimg.heraldcorp.com/content/default/2024/03/17/20240317050088_0.jpg?type=h&h=240,hansohee
"Ryu Jun-yeol, Han So-hee spotted together in Hawaii; agencies decline to confirm dating rumors",https://www.koreaherald.com/article/3348907,2024.03.15 16:07,"South Korean actors Ryu Jun-yeol and Han So-hee have been spotted on vacation at the same hotel in Hawaii, but both the actors' agencies on Friday declined to confirm rumors that the two are dating. According to posts on social media, Han and Ryu were reportedly seen vacationing together at a luxury hotel swimming pool in Hawaii. Amid the circling dating rumors, Ryu's agency released an official announcement. ""It is true that Ryu is staying in Hawaii for photography work. We kindly ask (the public) to respect the actor's (privacy) on his trip. In the future, (CJes Studios) will not respond to every rumor that comes from (the public) witnessing actors' private lives,"" read the statement by CJes Studios. 9 Ato Entertainment, the agency representing Han, said via local media outlets that ""it is true that Han went on a vacation to Hawaii with close female friends, but regarding the rest, we kindly request understanding (in declining to respond to any dating rumors) as it falls within the range of (Han's) privacy."" Currently, Han and Ryu are reportedly reviewing lead roles in a drama series titled ""Delusion,"" which narrates the story of an artist who takes on the task of drawing the portrait of an alluring woman.",https://wimg.heraldcorp.com/content/default/2024/03/15/20240315050556_0.jpg?type=h&h=240,hansohee
Korean stars ditch AirPods for old-school earphones,https://www.koreaherald.com/article/3339028,2024.03.04 14:23,"Whether it's a retro trend or just the convenience of not having to charge them in advance, wired earphones are making a comeback. On an episode of YouTube show “Lee Seojin's New York New York"" released last year, actor Jung You-mi was seen using wired headphones, prompting a curious inquiry from fellow actor Lee Seo-jin: ""What is up with your earphones?"" When asked, she explained, ""MZ generations use these."" And she was right, a growing number of millennial and Generation Z Korean celebrities -- roughly those born from the 1980s through the end of the century -- have been seen with wired earphones lately. On Wednesday, actor Han So-hee appeared at Incheon Airport with a white wire dangling from one ear. Similarly, actor Moon Ga-young was spotted with such wires at the airport. Blackpink members Jennie and Rose are also among those embracing the trend, frequently appearing at airports with wired earphones. During her “Inside Blackpink Singer Rose's YSL Bag” interview with Vogue France, Rose took out her wired earphones and said she has been using them because she is “not good at charging things.” Apple swiftly responded to the emerging trend, launching new wired earphones in September last year. Although the tech giant has primarily concentrated on wireless earphones, the release of the iPhone 15 also featured wired EarPods. The company asserted that the new wired earphones boast improved audio and microphone quality in comparison to their previously introduced wireless products.",https://wimg.heraldcorp.com/content/default/2024/03/04/20240304050560_0.jpg?type=h&h=240,hansohee
'Gyeongseong Creature' inadvertently raises historical awareness among viewers around the world,https://www.koreaherald.com/article/3312838,2024.01.30 15:02,"While the show's writer and director clearly said that their intention for ""Gyeongseong Creature,"" a Netflix original drama series, was to show how the people of the time lived, the show inadvertently raised awareness about the harrowing history of the Japanese colonization of Korea among viewers around the world. ""Gyeongseong Creature,"" which ended Jan. 5, has enjoyed global success, securing its position on Netflix's global top 10 list in the TV (Non-English) category for five consecutive weeks, from Dec. 18 to Jan. 14. ""Gyeongseong Creature"" tells of characters who embark on a quest for survival in 1945 during the Japanese colonial era. Through the language of metaphor, the drama series incorporates the acts of Unit 731, a unit of the Imperial Japanese Army that engaged in human experimentation during the 1940s, into the plot, with the story of the Japanese military that conducts experiments to turn Koreans into monsters. Regarding the historical theme of the series, international viewers whose countries had been occupied by the Japanese military during World War II said that the content reminded them of their country's history. ""Though I didn't personally live through the era, we know that Japanese imperialists brutally exploited and enslaved the Vietnamese people during the colonial period. The fact that 'Gyeongseong Creature' portrayed that time of history on a globally popular platform by symbolically comparing the acts to turning humans to 'monsters' reminded me of the history I learned about my ancestors -- and I was gratified for the opportunity,"" said Cais Nguyen, a Vietnamese American college student living in New York. Vietnam was colonized by the Japanese military after Japan invaded French Indochina in 1940. ""Victims of the Japanese colonial era are all over the globe. I think the fact that contents are reminding the descendants about their ancestors' hardships is very helpful,"" she said. ""Even though I know the drama series was made in Korea, I wish the drama series also touched upon the Japanese military's evil acts all over the world, since the work is being released on Netflix, and starring influential figures like Han So-hee. The story could have resonated with more international fans,"" said Farah Megat, a Malaysian American student. Malaya was occupied by the Japanese from 1941 to 1945, following the onset of the Pacific War. Japanese audience also echoed the view that ""Gyeongseong Creature"" serves to spread historical lessons. ""The drama series achieved empathy from the audience that treating people unequally and with disrespect is unpleasant and horrifying. I hope that those who have seen this work felt that, and that this work becomes an opportunity for such practices to disappear from the world in the future,"" said a Japanese viewer on Filmarks, a popular online Japanese film review site, in the review section for ""Gyeongseong Creature."" However, there was also a number of reviews from Japanese fans that criticized the drama series for imposing a one-sided, negative image of Japan. ""I cannot support productions that depict a specific country as evil and plant a fixed image,"" one review read. ""I understand that Japan occupied other countries, but sometimes, when dramas set in this era portray Japanese people negatively, it feels like they are intentionally provoking anti-Japanese sentiment,"" added another review on Filmarks. Media experts said that dramas and films could be a double-edged sword in terms of delivering historical messages. ""Some Japanese who have seen the drama series express the opinion that they want to learn more about Japan's history, such as its colonial rule of the Korean Peninsula and Unit 731, which they did not extensively study about in school,"" said a media industry official based in Japan on condition of anonymity. ""However, the majority of Japanese tend to perceive historical issues in dramas as fiction or consider them as elements that heighten tension in the plot by invoking anti-Japanese sentiment. They often view these portrayals as 'anti-Japanese propaganda' within South Korea, and, (as such,) there are certain limits on using dramas for historical education,"" she added.",https://wimg.heraldcorp.com/content/default/2024/01/30/20240130000580_0.jpg?type=h&h=240,hansohee
