title,url,date,content,thumbnail,celebrity
Solo debut with 'Seven' motivates BTS’ Jungkook to continue enhancing musical skills,https://www.koreaherald.com/article/3167994,2023.07.14 15:19,"BTS’ Jungkook finally made his official solo debut on Friday, with his first solo single, “Seven.” This solo debut comes a decade after Jungkook made his debut in the music scene as a member of K-pop sensation BTS back in 2013. “Through this single, I showed a new facet of myself that has never been shown better. The single is an addictive song that can be enjoyed easily by anyone. The first time I heard the song, I immediately thought, ‘I need to do this. This is it.’ I don’t easily get hooked on a song, but I did with this one. I could picture myself performing it,” Jungkook said, introducing his single to local reporters through a pre-recorded video on Friday. “Seven” is of the UK garage genre composed with an addictive melody and the sound of an acoustic guitar, which accentuates Jungkook's mellow vocals. “The rhythm, sound and mood of ‘Seven’ is very unique. The electronic rhythm in it makes it a perfect summer song that I hope to enjoy with a lot of people this summer,” said Jungkook. “The single sings about wanting to always be with one's loved one from Monday to Sunday -- seven days a week -- just like the title of the song itself. It is a passionate love serenade,"" he said. Many renowned artists took part in Jungkook’s first project as a solo artist including two music producers with Grammy awards, Andrew Watt and Cirkut. American rapper Latto also took part in this project by featuring on the single. “Latto infused her personal music style into the single well, making the track sound more attractive,” said Jungkook. Korean actress Han So-hee also starred in the music video for the single, which surpassed 1 million views on YouTube within just 10 minutes of its release. “I really contemplated how to make ‘Seven’ enjoyable for many people. ‘Seven’ is of a genre that I’ve never tried before. Even the process of bringing up this single was new to me. There was a lot to learn when I started recording. I now have a new goal of wanting to digest music better. I will give great concerts and performances with this single, so please look forward to them,” said Jungkook. Jungkook is set to perform the single for the first time on stage at Central Park in New York on Friday as part of its performance at the “2023 Summer Concert Series,” a summer concert hosted by ABC television network in the US.",https://wimg.heraldcorp.com/content/default/2023/07/14/20230714000507_0.jpg?type=h&h=240,hansohee
BTS' Jungkook renews Billboard records ahead of solo debut,https://www.koreaherald.com/article/3159676,2023.07.02 17:18,"Despite official debut on July 14 with digital single “Seven,” Jungkook has already had solo success BTS' Jungkook continues his record-setting streak on Billboard's global charts as he gears up for his solo debut this month. The US music publication's latest chart release on Saturday showed Charlie Puth's Jungkook collaboration, ""Left And Right,"" hit No. 179 on the Billboard Global US Exclusive chart that day, marking its 38th week on the chart. This extends Jungkook's own record of longest streak by an individual K-pop singer on the song chart. He also renewed his record on Billboard's Digital Song Sales chart with ""Euphoria"" last week. Returning to the list a year after it hit its 91st week in June 2022, the 2018 song soared to No. 6 last week and retained its status as the longest-charting song by a K-pop soloist on the chart. The BTS vocalist's songs have been rebounding on the global charts after rumors of new release in July. On Friday, the group's agency Big Hit Music confirmed that Jungkook will release his first official solo single, ""Seven,"" on July 14, taking his first leap as a soloist musician. The agency unveiled the promotion schedule for ""Seven"" on Sunday, which showed Jungkook will officially publish his self-written songs ""Still With You"" and ""My You"" on the global music platforms on July 3. The two songs were each made available for free in 2020 and 2022, respectively, on SoundCloud. The music video for ""Seven"" will come out at 1 p.m. on July 14, along with the song, the timeline showed. It was recently reported that actress Han So-hee may be starring on the music video but Big Hit Music refused to comment on the matter. Jungkook said a solo album was also in the making. ""I worked hard to show the direction of my music, the colors and my vocals that I haven't been able to properly address before with the song, so please don't be so disappointed that it's a single. I'm also working on an album,"" the singer during a livestream broadcast with fans on Friday following the agency's announcement. Jungkook has shown he can achieve musical success independent of the rest of BTS for some time. Before his appearance on Charlie Puth's ""Left And Right"" which peaked at No. 22 on the Billboard Hot 100 chart, he made the same chart with ""Stay Alive,"" a soundtrack for BTS' web-comic series ""7 Fates: Chakho."" And in 2020, although under BTS' name, he entered Hot 100 with his solo song ""My Time"" from the band's seventh LP ""Map of the Soul: 7."" In November, he sang the official soundtrack for 2022 FIFA World Cup, ""Dreamers,"" which became the first World Cup song to top Billboard's Digital Song Sales chart. It also topped the iTunes chart in 102 countries around the world. He recently scored a Guinness World Record as the fastest K-pop solo singer to garner a billion streams on Spotify.",https://wimg.heraldcorp.com/content/default/2023/07/02/20230702000150_0.jpg?type=h&h=240,hansohee
Women-centered series go mainstream in Korean content industry,https://www.koreaherald.com/article/3127874,2023.05.17 14:50,"Building on successes with charismatic, independent female leads, more women's stories set to entertain the viewers Portraying relationships between female leads -- be it friendship or rivalry -- is becoming the dominant trend for successful projects in South Korea. While 2022 TV dramas received both local and global popularity with strong, independent woman -- “Juvenile Justice,” “Extraordinary Attorney Woo,” “Under the Queen’s Umbrella” and more -- this year’s projects explore more female-centered stories with multiple female leads. Lim Ji-yeon and Song Hye-kyo, who presented a fierce confrontation between a school bullying offender and victim in Netflix’s smash-hit “The Glory,” are each set to return in new series with different partners. Lim, who played iconic villain Yeon-jin in “The Glory,” portrays a pregnant woman who is a victim of domestic violence in the Genie TV original “Lies Hidden in My Garden.” The thriller series is expected to be one of the most anticipated of the year, as top actor Kim Tae-hee makes a return to the small screen three years after 2020's “Hi Bye, Mama!” “Lies Hidden in My Garden” revolves around ordinary housewife Joo-ran (Kim), whose life goes in an unexpected direction after noticing a strange smell in her backyard and meeting domestic violence victim Sang-eun (Lim). The series is set to premiere on June 19 and will be available via local streamer ENA. Meanwhile, Song is set to star in another blood-soaking revenge story in “Cost of Confession.” Though the release date of the series is yet to be announced, the upcoming show presents the story of ordinary art teacher Eun-soo (Song), whose life drastically changes with an unexpected murder case. Many passionate TV drama fans shared that they were thrilled to watch the series as ""The World of Married"" and ""My Name"" star Han So-hee joins as a mysterious woman feared by everyone. “Smugglers,” an upcoming heist movie, hopes to become one of very few notable female-led films in this year, starring Kim Hye-soo and Yum Jung-ah as haenyeo, woman divers who dive without oxygen to farm the ocean to support their families. The film hits local theaters in July. Though many local broadcasters and video streamers have released melodramas and once-popular rom-coms like KBS’ “Oasis,” Disney+’s “Call It Love,” SBS’ “The Secret Romantic Guesthouse” and more, those series received less-than-expected attention from the audience, earning a single-digit percent viewership ratings. “As TV dramas are mostly enjoyed by female viewers, I think the ‘womance’ series are certainly quenching the female-dominated audience’s thirst for interesting stories other than a woman from a poor background falls in love with a prince-like male lead,” culture critic Hwang Jin-mi told The Korea Herald. Womance is a combination of the words ""woman"" and romance,"" referring to nonsexual, tight bonds between female characters going above and beyond ordinary friendship. Hwang believes the trend is likely to continue with more exciting stories in the near future as well.",https://wimg.heraldcorp.com/content/default/2023/05/17/20230517000542_0.jpg?type=h&h=240,hansohee
"Among Korean films at Jeonju IFF, queer films stand out",https://www.koreaherald.com/article/3117858,2023.05.03 17:19,"This year’s Jeonju International Film Festival, which opened on April 27, has nominated films of various genres and topics to the Korean competition, but what really stood out were the queer films that were nominated. “Of 111 Korean films that were submitted for the Korean competition section, we chose 8 feature films, two documentaries and one experimental documentary as finalists. A total of 11 films are nominated and they are either the first or second project of the filmmakers. It shows how Jeonju IFF serves as a gateway for these first-time directors,” said Moon Seok, who developed Jeonju IFF's program, adding that queer films have become a noticeable trend this year. Director Jay Han’s second feature-length indie film, “No Heaven, But Love,” revolves around a high school student, Joo-young (Park Soo-yeon), and Ye-ji (Lee Yoo-mi), who attends the reform school at a youth detention center, and their lesbian romance. Set in 1999, the film depicts the rough and violent atmosphere at the school in an era when corporal punishment was still legal and the harassment of junior students by senior students with violence was widely tolerated in the name of ""tradition."" Going through such struggles together, Joo-young and Ye-ji form a special relationship. “Although there are dark and violent scenes in our film, the fundamental genre of our film is romance. I did not want the film to be perceived as something too serious or too scary,” Han said during a talk held after a screening at the Jeonju IFF. Focusing on how Joo-young finds Ye-ji to be someone she can trust the most and accept everything without prejudice, Han shows that what’s most important in our society is the feeling of loving someone, not following social norms or living a standardized life with fixed biases. “These characters are pure. What makes lesbian love difficult is not that one is struggling to find one’s identity or having inner conflict within oneself,"" Han said, reflecting on how for the film's characters, love is just love. Han continued, ""Not all love is easy,” adding that this line says everything about the film: “I will stay with you even if I die next year.” In director Yoon Soo-ik’s “Heavy Snow,” which was shot in 2019, high school students Soo-an (Han Hae-in) and Seol (Han So-hee) agonize over whether they should continue do to filmmaking or acting. Seol, who is already a popular screen actor, shares thoughts deep inside her heart with Soo-an and the two become close. The film garnered attention as actor Han So-hee’s debut film, which Han Hae-in did before appearing in 2020 hit drama “The World of the Married.” “I’m the type of person who is easily swayed by the mood of the season and the weather. What I valued during the shooting was to portray the feeling of loneliness and isolation, and that was shown by the sea in Yangyang in Gangwon Province on a snowy day,” said director Yoon during a talk held after a screening of ""Heavy Snow"" at the Jeonju IFF. “I don’t mean to produce a work with certain purpose or intention, but rather stick to what I want to tell (at the time of creating the project),"" Yoon continued. “For Soo-an, Seol is a special person who not only makes her happy but also reminds her of what kind of agonies Seol must have gone through, after Soo-an also embarks on her acting career later on -- something she did not notice when both were very young,” actor Han Hae-in told the audience during the talk, adding that their romance may have been closer to a form of idolization.",https://wimg.heraldcorp.com/content/default/2023/05/03/20230503000722_0.jpg?type=h&h=240,hansohee
CHARLES & KEITH welcomes Han So Hee to the CHARLES & KEITH Family as its newest ambassador,https://www.koreaherald.com/article/3117933,2023.05.03 15:30,"SINGAPORE, May 3, 2023 /PRNewswire/ -- Actress Han So Hee has been announced as the newest global brand ambassador of CHARLES & KEITH, joining the brand's growing family. ""Han So Hee embodies the spirit of CHARLES & KEITH with her authentic individuality, confidence and creativity. We are delighted to welcome her onboard the CHARLES & KEITH Family and inspire new possibilities together,"" said brand co-founder, Keith Wong. Han So Hee is set to star in the brand's Fall Winter 2023 campaign which will be unveiled in the third quarter of 2023.",https://wimg.heraldcorp.com/news/cms/2023/05/03/20230503000638.62e98b45-0982-4cd8-980a-03a13f45a150_T1.jpg?type=h&h=240,hansohee
Kakao Entertainment announces 2023 production lineup as it expands its premium content portfolio to global markets,https://www.koreaherald.com/article/3061829,2023.02.14 10:10,"SEOUL, South Korea, Feb. 14, 2023 /PRNewswire/ -- Kakao Entertainment announced plans to develop some 30 movies and TV series this year with production companies in its studio network. This year's development slate is more ambitious in scale than the 20 titles produced last year. Roughly, a dozen titles are already confirmed for release within this year by global streaming platforms, movie theaters, and TV stations; other titles will be confirmed soon. The new lineup reaffirms Kakao Entertainment's competitive ability to present multiple megahits through its multi-label system and will further solidify its reputation as a global production studio. ""We'll continue to enhance our studio system and boost synergy with the incredibly talented creatives and production capabilities of our subsidiaries,"" said Jang Se-jeong, Kakao Entertainment's head of scripted content business. ""This will allow us to further diversify our premium content IPs and increase our footprint in the global entertainment industry."" Having captivated audiences worldwide last year with series such as ""Narco-Saints"" and ""Money Heist: Korea - Joint Economic Area,"" Kakao Entertainment will plan and develop more content this year based on strong partnerships with global OTT players. Some projects have already scored streaming deals, including the Netflix series ""Gyeongseong Creature"" and ""Song of the Bandits,"" Netflix movie ""The Match,"" Disney+ original series ""Race"" and ""The Worst of Evil,"" all of which are scheduled to premiere this year and are already generating high expectations globally. Written by Kang Eun-kyong, head writer at content creation studio Gleline, ""Gyeongseong Creature"" is an ultra-large-scale global project produced by Story & Pictures Media and co-produced by Kakao Entertainment and Studio Dragon. Set in the spring of 1945, which is one of the darkest times in Korean history, the thriller depicts a young man and woman fighting monsters born out of greed. Starring Park Seo-Jun and Han So-hee, the title has not yet premiered but has already been confirmed for Season 2. ""Race,"" co-produced by Baram Pictures and Slingshot Studios, is an office drama that follows a group of hard-working individuals trying to prove their potential at a marketing agency. The cast lineup is stellar, including Lee Yeon-hee, Hong Jong-hyun, Moon So-ri, and Jung Yoon-ho. Another Netflix series, ""Song of the Bandits,"" is an action melodrama revolving around the lives of Koreans who moved to the lawless land of Gando for different reasons, eventually joining forces to protect their land and loved ones. Planned by Studio Dragon and co-produced by Urban Works and Baram Pictures, the new title is already gaining much attention thanks to a solid cast that includes Kim Nam-gil, Seohyun, and Yoo Jae-myung. Disney+'s upcoming series, ""The Worst of Evil,"" will be also produced by Kakao Entertainment's two subsidiaries, Baram Pictures and Sanai Pictures. Starring Ji Chang-wook and Wi Ha-jun, the crime-action drama follows an undercover investigation started in Seoul, which then escalates into an infiltration mission to crack down on illegal drug trade between Korea, China, and Japan. For this title, Baram Pictures brings its contents planning and development knowhow to create synergy with Sanai Pictures, known for its strength in action noirs. ""The Match,"" is a Netflix film that tells the story of two legendary Go players in Korea, Cho Hun-hyun and his protege and future rival Lee Chang-ho. Produced by Moonlight Film and co-produced by BH Entertainment, the movie features Lee Byung-hun in the lead role as Cho Hun-hyun, and Yoo Ah-in as Lee Chang-ho. Kakao Entertainment is also working to build a stronger catalog of movie productions. Having released ""Broker"" and ""Hunt"" last year, it is gearing up to deliver a more eclectic portfolio to the audience, with ""Hopeless,"" ""Cross,"" ""The Plot (working title),"" and ""Nocturnal."" ""Hopeless"" (Sanai Pictures) is an action noire of people who make dangerous choices to get away from their living hell. Directed by Kim Chang-hoon, the movie stars Song Joong-ki, Hong Xa-bin, and Kim Hyung-seo (also known as BIBI). The spy action movie ""Cross"" (Sanai Pictures) revolves around a couple, Kang-moo (played by Hwang Jung-min) and Miseon (played by Yum Jung-ah). Kang-moo is a former special forces officer hiding his past from his wife, who is a violent crime detective. When they get involved in the same case, they are forced to work together. Both produced by Sanai Pictures, ""Hopeless"" and ""Cross"" are among the year's most anticipated films. Additionally, Zip Cinema's production ""The Plot (working title)"" is currently in post-production. The thriller is about the boss of a contract murder organization faced with unexpected accidents. Directed by Lee Yo-sup, the film stars Gang Dong-won, Lee Mi-sook, Lee Hyun-wook, and Tang Jun-sang. Finally, ""Nocturnal"" is a nail-biting action thriller about a man trying to reveal the truth behind the mysterious death of his brother, starring Ha Jung-woo and Kim Nam-gil, from the producers of Sanai Pictures. Kakao Entertainment will also speed up the planning and production of content based on its original story IPs. Baram Pictures and Arc Media will co-produce the drama adaptation of the webtoon ""Not Others (working title)"" Serialized on Kakao Webtoon, it features a cool daughter and a helpless mother living together. Released this month, ""Our Blooming Youth"" is a love story centered on a crown prince suffering from a mysterious curse and a genius girl who is accused of murdering her entire family. The title stars Park Hyung-sik and Jeon So-nee.",https://wimg.heraldcorp.com/news/cms/2023/02/14/20230214000197.3a097aeb-7494-492e-8908-c86dbc86f123_T1.jpg?type=h&h=240,hansohee
"Seventeen, Stray Kids, Ive, Lee Jun-ho take top honors at 2022 AAA",https://www.koreaherald.com/article/3019504,2022.12.14 14:36,"The 2022 Asia Artist Awards in Japan recognized breakout stars of this year, with Seventeen, Stray Kids, Ive and Lee Jun-ho taking the top honors of the night. The AAA ceremony took place Tuesday at the Nippon Gaishi Hall in Nagoya, Japan. This year saw the return of a live audience for the first time in three years, with streams of singers and artists attending to celebrate the honorable night together. Named for the five grand prizes for musicians were Seventeen as the year's top singer, Stray Kids for album of the year, Ive for this year's top song, New Jeans for this year's top performance and Lim Young-woong for this year's top stage. Lee Jun-ho was named best actor. The biggest winner of the night was Lim Young-woong, who clinched a total of four trophies, including the Popularity award, Hot Trend award and Fabulous award. Rookie girl groups Ive and New Jeans together nabbed the new artist award, each taking home two prizes. Ive debuted in December 2021 with single ""Eleven"" and New Jeans in August with a self-titled EP. Le Sserafim, which debuted in May with the EP ""Fearless,"" also shared the rookie artist award. Actors Kang Daniel and Seo Bum-june nabbed the best rookie artist award. Named for best artist were Itzy, the Boyz and the Rampage from Exile Tribe and actors Han So-hee, Seo In-guk and Park Min-young. Other winners included musical acts Treasure, Choi Yena, NiziU, ATBO, Kard, Cravity, TrendZ, NMIXX, AleXa, Verivery, Lightsum, Pentagon, Tempest, Kep1er, and Peck Palitchoke, along with actors Lee Jae-wook, Kim Seon-ho, Kim Se-jeong, Lee Jun-young, Kwon Yuri, Hwang Min-hyun, Kim Young-dae, Bona and Choi Si-won. A total of 35 musical acts and 18 actors attended the show Tuesday night. Leeteuk of Super Junior and Jang Won-young partnered for the second time to host the event The AAA is an annual entertainment award that kicked off in 2016. This is the first time the event took place live with an audience since it was last held in 2019 in Hanoi, Vietnam. This year's show was also livestreamed via various online platforms. The celebration continued into the next day at the gala show ""2022 AAA After Stage."" The first such event showcased by AAA, a star-studded lineup of performers, including Seo In-guk, Billlie, Kep1er and Pentagon, took the stage.",https://wimg.heraldcorp.com/content/default/2022/12/14/20221214000513_0.jpg?type=h&h=240,hansohee
Womance dramas dominate Korean television,https://www.koreaherald.com/article/2828024,2022.03.29 09:14,"Hit television dramas portraying the special bond between female characters have given rise to a genre called “womance.” A combination of the words “woman” and “romance,” womance refers to the non-sexual, tight bond between female characters that goes above and beyond ordinary friendship. Though there have been many films and television shows centering around “bromance” – a combination of the words “brother” and “romance,” and the equivalent of womance -- including the hit movie “Friend” (2001), KBS’ “Boys over Flowers” (2009), SBS’ “A Gentleman’s Dignity” (2012), “The Heirs” (2013), action thriller “New World” (2013), KBS’ “School 2017” (2017) and “School 2021” (2021), womance-themed projects have started to attract attention recently. The romance between the two main characters aside, tvN’s “Twenty Five Twenty One” has captured viewers’ attention with the relationship of two teen fencers Na Hee-do (played by Kim Tae-ri) and Ko Yu-rim (played by Bona) developing from an athlete-fan relationship to rivals and best friends. With another high school friend Ji Seung-wan (played by Lee Ju-myoung), the 16-part series portrays teenagers pursuing their dreams and ambitions. The latest episode of “Twenty Five Twenty One” on March 27 recorded 12.9 percent viewership according to Nielsen Korea, topping the ratings among television shows airing in the same time slot. JTBC’s “Thirty Nine” presents a different style of womance with a trio of best friends -- Cha Mi-jo (played by Son Ye-jin), Jeong Chan-young (played by Jeon Mi-do) and Jang Joo-hee (played by Kim Ji-hyun) -- and their love lives on the brink of turning 40. The characters of “Thirty Nine” show a 20-year friendship that is stronger than the bonds with their families and lovers. It is a heartwarming story centering around the terminally ill Chan-young. Meanwhile, SBS’ rom-com “Business Proposal” is also riding the trend with the chemistry between young office worker Shin Ha-ri (played by Kim Se-jeong) and her childhood friend Jin Yeong-seo (played by Seor In-a). “Starting in 2016, broadcasters have been showing womance stories such as tvN’s ‘Dear My Friends’ (2016), JTBC’s ‘Melodramatic’ (2019) and Tving’s ‘Work Later, Drink Now’ (2021),” said culture critic Hwang Jin-mi. “As more drama fans, especially female viewers, got tired of watching characters falling in love with a Prince Charming, different approaches were needed,” Hwang added. The critic believes that the growing number of television series featuring womance allow the viewers to see many sides of women in our society. “Ranging from a calm career woman to a mother devoted to her family, there are different types of women. And this development, continuing since 2016, is meaningful to the Korean content industry,” Hwang said. “With the growing popularity of global streaming services, more multidimensional characters are being played by female actors, including Han So-hee of Netflix’s action noir ‘My Name’ and Kim Hye-soo of ‘Juvenile Justice.’” “Business Proposal” and “Twenty Five Twenty One” also caught global viewers’ attention, respectively ranking fifth and sixth place as of Monday on the global Netflix chart according to the US-based streaming analytics firm FlixPatrol. By Lee Si-jin ()",https://wimg.heraldcorp.com/content/default/2022/03/28/20220328000560_0.jpg?type=h&h=240,hansohee
