url,title,date,thumbnail,content,celebrity,relevance_score,relevance_reason,source,headline,subheading,category,subcategory,category_reason
https://www.koreaherald.com/article/3641637,"김수현 전지현, 중국 생수 광고 찍었더니 비난 봇물, 왜?",2014-06-20,https://wimg.heraldcorp.com/content/default/2014/06/20/20140620001328_0.jpg?type=h&h=240,"드라마 ‘별에서 온 그대’로 중국 내 뜨거운 인기몰이를 하고 있는 김수현과 전지현이 중국에서 ‘장백산’ 생수의 모델이 됐다고 알려져 네티즌들의 공분을 사고 있다.  최근 김수현과 전지현은 중국 ‘헝다그룹’의 생수 광고 모델로 나섰다. ‘백두산 광천수’로 만든 제품으로 알려졌는데, 문제는 생수 취수원이 중국 동북공정의 일환으로 ‘백두산’이 아닌 ‘장백산’으로 표기되어 있는 것. 네티즌들은 김수현과 전지현이 백두산이아니라 ‘장백산’ 생수 제품의 모델이 됐다며 분노하고 있다. 드라마 ‘별에서 온 그대’로 중국 내 뜨거운 인기몰이를 하고 있는 김수현과 전지현이 중국에서 ‘장백산’ 생수의 모델이 됐다고 알려져 네티즌들의 공분을 사고 있다. 최근 김수현과 전지현은 중국 ‘헝다그룹’의 생수 광고 모델로 나섰다. ‘백두산 광천수’로 만든 제품으로 알려졌는데, 문제는 생수 취수원이 중국 동북공정의 일환으로 ‘백두산’이 아닌 ‘장백산’으로 표기되어 있는 것. 네티즌들은 김수현과 전지현이 백두산이아니라 ‘장백산’ 생수 제품의 모델이 됐다며 분노하고 있다. (onlinenews@heraldcorp.com)   <관련 영문 뉴스> Kim Soo-hyun, Jun Ji-hyun mired in controversy over Chinese ad Korean heart throbs Kim Soo-hyun and Jun Ji-hyun, the couple from “My Love from the Star,” are facing criticism after they shot a Chinese commercial for drinking water with an incorrectly labeled water source. Both were earlier tapped as models for Chinese mineral water Hengda bingquan. Later, however, controversy grew after it was revealed that the water company listed the water source as “Jang bai shan” rather than the original Korean name -- Mount Baekdusan. Calling the mountain lying on the border of North Korea and China “Jang bai shan” has been pushed as part of China’s Northeast Project that ignited uproar from South Korea. The project refers to a four-year scheme to rewrite history that the Chinese government launched in 2002. The project aims, among other things, to describe Goguryeo, one of the three ancient Korean kingdoms, as part of ancient Chinese territory. As the controversy grew over the water commercial, Kim’s management agency apologized for the insufficient check of the water source. “The agency feels sorry for not checking the water source thoroughly. We will be more cautious in other ads in the future,” said Kim’s agency. Jun’s management agency also attempted to calm down public opinion. “We made the contract only for the commercial. It’s our fault that we didn’t check the water source in advance,” said the agency. “We may need to talk to our Chinese counterpart.” The couple has already finished the ad shoot, reportedly bringing record pay -- 1 billion won. ()",kimsoohyun,5.0,"The article directly discusses Kim Soo-hyun's involvement in a controversial Chinese water advertisement. It details his role as a model for Hengda bingquan water company, the controversy surrounding the naming of Mount Baekdu/Jang bai shan, and includes his agency's official apology for the incident. The article is entirely focused on Kim Soo-hyun and his co-star Jun Ji-hyun's involvement in this specific advertising controversy.",,Kim Soo-hyun's Chinese Water Ad Sparks National Outrage,Korean superstar Kim Soo-hyun faces backlash after appearing in controversial mineral water commercial that renames sacred mountain,Controversy,Political Controversy,"The article discusses public outrage and backlash against Kim Soo-hyun for appearing in a Chinese commercial that involves a politically sensitive issue regarding the naming of a sacred mountain, making it a controversy with political implications between Korea and China."
https://www.koreaherald.com/article/3641945,"Kim Soo-hyun, Jun Ji-hyun mired in controversy over Chinese ad",2014-06-20,https://wimg.heraldcorp.com/content/default/2014/06/20/20140620001181_0.jpg?type=h&h=240,"Korean heart throbs Kim Soo-hyun and Jun Ji-hyun, the couple from “My Love from the Star,” are facing criticism after they shot a Chinese commercial for drinking water with an incorrectly labeled water source. Both were earlier tapped as models for Chinese mineral water Hengda bingquan. Later, however, controversy grew after it was revealed that the water company listed the water source as “Jang bai shan” rather than the original Korean name -- Mount Baekdusan.  Calling the mountain lying on the border of North Korea and China “Jang bai shan” has been pushed as part of China’s Northeast Project that ignited uproar from South Korea. The project refers to a four-year scheme to rewrite history that the Chinese government launched in 2002. The project aims, among other things, to describe Goguryeo, one of the three ancient Korean kingdoms, as part of ancient Chinese territory. As the controversy grew over the water commercial, Kim’s management agency apologized for the insufficient check of the water source. “The agency feels sorry for not checking the water source thoroughly. We will be more cautious in other ads in the future,” said Kim’s agency. Jun’s management agency also attempted to calm down public opinion. “We made the contract only for the commercial. It’s our fault that we didn’t check the water source in advance,” said the agency. “We may need to talk to our Chinese counterpart.” The couple has already finished the ad shoot, reportedly bringing record pay -- 1 billion won. ()",kimsoohyun,5.0,"The article directly focuses on Kim Soo-hyun as one of its main subjects, discussing his involvement in a controversial Chinese commercial and his agency's response to the situation. It details both the specific incident and the resulting public reaction to his participation in the advertisement, making it highly relevant to him personally and professionally.",,Kim Soo-hyun's Chinese Water Ad Sparks Historical Controversy,Korean superstar Kim Soo-hyun and co-star Jun Ji-hyun face backlash over commercial featuring disputed mountain name,Controversy,Political Controversy,"The article discusses backlash over a commercial featuring Kim Soo-hyun that involves a disputed geographical location name between countries, making it a political controversy rather than just a standard brand promotion issue."
https://www.koreaherald.com/article/3641622,"김수현 - 전지현 중국광고 논란, 동북공정에 이용 당해?",2014-06-20,https://wimg.heraldcorp.com/content/default/2014/06/20/20140620001157_0.jpg?type=h&h=240,"드라마 ‘별에서 온 그대’로 중국 내 뜨거운 인기몰이를 하고 있는 김수현과 전지현이 중국에서 ‘장백산’ 생수의 모델이 됐다고 알려져 네티즌들의 공분을 사고 있다. 최근 김수현과 전지현은 중국 ‘헝다그룹’의 생수 광고 모델로 나섰다. ‘백두산 광천수’로 만든 제품으로 알려졌는데, 문제는 생수 취수원이 중국 동북공정의 일환으로 ‘백두산’이 아닌 ‘장백산’으로 표기되어 있는 것. 네티즌들은 김수현과 전지현이 백두산이아니라 ‘장백산’ 생수 제품의 모델이 됐다며 분노하고 있다. 김수현 소속사 키이스트 측 관계자는 “지금은 어떠한 말도 논란이 될 수 있기 때문에 조심스럽다”며 “당초 광고 계약을 맺을 때는 ‘헝다생수’라는 상품명만 알고 있었다. 관련 내용은 중국 측에서도 면밀히 검토하고 있다”고 강조했다. 소속사 측은 “촬영은 지난 주 끝마쳤다. 광고는 영상이 아닌 지면 촬영만 진행했다”고 했다. 김수현 전지현 장백산 생수 광고에 네티즌들은 “김수현 전지현, 제대로 하길” “김수현 전지현, 위기네” 등의 반응을 보였다. (onlinenews@heraldcorp.com)   <관련 영문 뉴스>  Kim Soo-hyun seals 35 commercial ad deals  Actor Kim Soo-hyun, who stole the hearts of fans in Asia, also caught the eyes of international advertising firms, setting a staggering record with a total of 35 commercial deals this year. According to a local advertising expert, Kim has recently filmed 15 commercials in South Korea, showing his strength as an “ad powerhouse.” “It is unusual for one celebrity to appear in over 15 ads. Because similar products in the same field normally don’t go for the same model during the same period of time,” the expert said, explaining Kim’s high stature as a celebrity. Since Kim jumped to stardom with the success of the drama series “Moon Embracing the Sun” in 2012, he has had some ups and downs. Following the drama series “My Love from the Star” Kim’s popularity took flight outside of Korea. International business firms such as Coca-Cola, Tencent Holdings and Aokang Group, mainly targeting Chinese consumers, have sealed advertising deals. Industry giants’ efforts to catch Kim have also been out of the ordinary. Coca-Cola China lifted item restrictions to host Kim while Aokang Group, China’s largest shoemaking enterprise, sent a private jet to invite Kim to one of the group’s promotional events. Due to Kim’s growing popularity in Asia, he has even had to turn down some offers. “We had additional firms that sent love calls to shoot commercials with them. But we are refraining from them (filming advertisements) for his next script and public image,” Kim’s management company, Keyeast Entertainment, said. According to the management agency, Kim is carefully studying scripts so that he can return to the screen with a fine piece of work. Meanwhile, the “Commercial King” made $294,406 in donations with his advertising income for the victims of Sewol ferry disaster that left 304 passengers dead or missing. He has also raised $196,270 for children in China. By Ha Ji-won, Intern reporter ()",kimsoohyun,5.0,"The article directly discusses Kim Soo-hyun's involvement in a controversial Chinese advertisement for Changbai Mountain (Baekdu Mountain) water, as well as his broader success in Chinese advertising markets. It details both the specific controversy and his overall commercial influence, mentioning that he secured 35 commercial deals and became highly sought after by major companies following his success in ""My Love from the Star."" The article provides significant detail about his commercial activities and their impact.",,Kim Soo-hyun's Advertising Empire Hits Record-Breaking 35 Deals,"Korean superstar Kim Soo-hyun becomes most sought-after celebrity in Asian advertising, turning down offers despite commanding top dollar from global brands",Promotion,Brand activities,"The article focuses on Kim Soo-hyun's commercial success and unprecedented achievement in securing 35 advertising deals, specifically discussing his status as a top brand ambassador in the Asian advertising market. The content is primarily about his commercial endorsements and brand value rather than his acting work, personal life, or other activities."
https://www.koreaherald.com/article/3641730,Kim Soo-hyun’s Chinese fans to buy apartment just to be his neighbors,2014-06-19,https://wimg.heraldcorp.com/content/default/2014/06/19/20140619001136_0.jpg?type=h&h=240,"Some rich Chinese fans are hoping to buy certain apartments in Seoul just to become neighbors of hallyu star Kim Soo-hyun, according to real estate agencies. Property dealers said two Chinese women in their 40s and a legal representative of a Chinese mogul visited Seoul to buy an apartment neighboring the Korean actor’s flat. Kim rose to fame in China with SBS drama series “My Love from the Star,” in which he plays an alien who falls in love with A-list star Cheon Song-yi, played by actress Jun Ji-hyun. Galleria Foret, a posh apartment building where Kim allegedly lives, is located in the eastern district of Seongdong-gu with units listed for $500,000 and up. “The so-called ‘Cheon Song-yi house’ that neighbors Kim’s apartment jumped up to $4.4 million, but the owner has no intention of selling for now,” a realty broker was quoted as saying. Kim, who enthralled many Chinese women, also received a full-page newspaper advertisement from a Hong Kong fan who is the wife of a local conglomerate owner. By Ha Ji-won, Intern reporter ()",kimsoohyun,5.0,"The article is directly about Kim Soo-hyun, discussing how his Chinese fans are trying to buy apartments near his residence in Seoul. It demonstrates his massive popularity in China following his role in ""My Love from the Star"" and provides specific examples of wealthy fans' attempts to become his neighbors, making it highly relevant to him as the central subject.",,Chinese Fans Bid Millions to Be Kim Soo-hyun's Neighbors,"Wealthy admirers from China are hunting for luxury Seoul apartments near Kim Soo-hyun's residence, with some units fetching up to $4.4 million",Social,Real estate,"The article focuses on real estate activity related to Kim Soo-hyun, specifically how Chinese fans are purchasing luxury apartments near his residence in Seoul. While it's not about Kim's own property purchase, it's a real estate phenomenon directly connected to his celebrity status affecting property values and purchases in his neighborhood."
https://www.koreaherald.com/article/3641128,Kim Soo-hyun seals 35 advertising deals,2014-06-15,https://wimg.heraldcorp.com/content/default/2014/06/15/20140615000352_0.jpg?type=h&h=240,"Actor Kim Soo-hyun, who stole the hearts of fans in Asia, also caught the eyes of international advertising firms, setting a staggering record with a total of 35 commercial deals this year. According to a local advertising expert, Kim has recently filmed 15 commercials in South Korea, showing his strength as an “ad powerhouse.” “It is unusual for one celebrity to appear in over 15 ads. Because similar products in the same field normally don’t go for the same model during the same period of time,” the expert said, explaining Kim’s high stature as a celebrity. Since Kim jumped to stardom with the success of the drama series “Moon Embracing the Sun” in 2012, he has had some ups and downs. Following the drama series “My Love from the Star” Kim’s popularity took flight outside of Korea. International business firms such as Coca-Cola, Tencent Holdings and Aokang Group, mainly targeting Chinese consumers, have sealed advertising deals. Industry giants’ efforts to catch Kim have also been out of the ordinary. Coca-Cola China lifted item restrictions to host Kim while Aokang Group, China’s largest shoemaking enterprise, sent a private jet to invite Kim to one of the group’s promotional events. Due to Kim’s growing popularity in Asia, he has even had to turn down some offers. “We had additional firms that sent love calls to shoot commercials with them. But we are refraining from them (filming advertisements) for his next script and public image,” Kim’s management company, Keyeast Entertainment, said. According to the management agency, Kim is carefully studying scripts so that he can return to the screen with a fine piece of work. Meanwhile, the “Commercial King” made $294,406 in donations with his advertising income for the victims of Sewol ferry disaster that left 304 passengers dead or missing. He has also raised $196,270 for children in China. By Ha Ji-won, Intern reporter ()",kimsoohyun,5.0,"The article is entirely focused on Kim Soo-hyun, specifically discussing his success in advertising deals, his rise to fame through dramas like ""Moon Embracing the Sun"" and ""My Love from the Star,"" and his impact in both Korean and international markets. It provides detailed information about his commercial activities, earnings, and charitable contributions, making it directly and highly relevant to him.",,Kim Soo-hyun Breaks Records with 35 Ad Deals as Asia's Most Wanted Star,"From drama success to international fame, Kim Soo-hyun's commercial appeal has brands sending private jets and breaking contract rules to secure his endorsement",Promotion,Brand activities,"The article focuses on Kim Soo-hyun's commercial success and endorsement deals, specifically highlighting his record-breaking 35 advertising contracts and his high demand among brands, even prompting extraordinary measures like private jet transportation to secure his endorsements."
https://www.koreaherald.com/article/3641020,Actor Lee Jong-suk steals China’s heart,2014-06-12,https://wimg.heraldcorp.com/content/default/2014/06/12/20140612001692_0.jpg?type=h&h=240,"Actor Lee Jong-suk’s popularity is continuing to increase in China, attracting the attention of head hunters who are targeting the mainland. Dubbed as one of the “Fantastic Four of Hallyu,” all of Lee’s recent shows -- “School 2013,” “I Hear Your Voice” and “Doctor Stranger” -- have been successful in Chinese-speaking countries, proving his popularity among Chinese fans. The other three are Kim Soo-hyun, Lee Min-ho and Kim Woo-bin. To respond to his international fans, Lee Jong-suk streamed scenes from the filming of “Doctor Stranger” in Hungary on Weibo, a Chinese version of Tweeter, even before the show went on air. Lee is a sensation in China with enthusiastic fans trying to catch Lee’s shows online. “Doctor Stranger” has hit 150 million downloads on Youku and Todou, Chinese versions of YouTube. Watchers are expecting the count to surpass 600 million by the time “Doctor Stranger” goes off the air, given that Lee’s previous drama series “I Hear Your Voice” scored 350 million downloads by the end of the 18 episodes. Moreover, some passionate Chinese fans joined forces with Korean fans to support Lee during the shoot. The fans hired gourmet buffet catering for the whole staff of “Doctor Stranger,” proving Lee’s ever-growing fame. Due to Lee’s very visible popularity, head hunters for local drama productions, advertisement companies, movie industries and entertainment officials are eager to cast the rising star. According to an official in the Chinese entertainment industry, local head-hunters are eyeing the chance to approach Lee once he finishes filming for “Doctor Stranger.” Lee made his acting debut in 2010 after starting out as a model. By Ha Ji-won, Intern reporter ()",kimsoohyun,3.0,"The article mentions Kim Soo-hyun only briefly as one of the ""Fantastic Four of Hallyu"" alongside Lee Jong-suk, Lee Min-ho, and Kim Woo-bin. While this reference establishes Kim Soo-hyun's status as a top Hallyu star in China during this period, the article primarily focuses on Lee Jong-suk's activities and success in China.",,Kim Soo-hyun Among Elite 'Fantastic Four' Driving China's Hallyu Wave,Rising star Lee Jong-suk joins Kim Soo-hyun and other top Korean actors dominating Chinese entertainment markets,Social,Social Recognition,"The article focuses on Kim Soo-hyun's status and recognition as one of the ""Fantastic Four"" Korean stars driving the Korean Wave (Hallyu) in China, highlighting his influence and standing in the international entertainment market rather than a specific project or activity."
https://www.koreaherald.com/article/3640944,Kim Soo-hyun slams plastic surgery rumor,2014-06-10,https://wimg.heraldcorp.com/content/default/2014/06/10/20140610001817_0.jpg?type=h&h=240,"Korean sensation Kim Soo-hyun has dismissed growing rumors in China about his having had plastic surgery as totally groundless. A Chinese news outlet raised the possibility that Kim had gotten plastic surgery, claiming that the actor is a perfect product made through plastic surgery. But Kim ended the controversy at a recent news conference in China.   “Many South Korean celebrities get plastic surgery. Have you done it too?” a reporter asked. 　 “Not all Korean celebrities undergo plastic surgery,” Kim replied. “I am still young, so I don’t need it.” Since Kim played a leading role on the SBS drama series “My Love from the Star,” he has risen to stardom in Asian countries such as China, Singapore, Malaysia and Thailand. By Ha Ji-won, Intern reporter (jiwonha@heraldcorp.com) Photo credit: Giogia",kimsoohyun,5.0,"The article is directly about Kim Soo-hyun, addressing his personal response to plastic surgery rumors about himself and mentions his rise to fame through ""My Love from the Star."" It features direct quotes from him and discusses his popularity in Asian countries, making it highly relevant to him as the central subject.",,"Kim Soo-hyun Shuts Down Plastic Surgery Rumors: ""I'm Still Young""",Rising Asian superstar Kim Soo-hyun confronts Chinese media speculation about his natural looks during recent press conference,Promotion,Media appearance,"The article covers Kim Soo-hyun's response to plastic surgery rumors during a press conference, which is a media event where he directly addressed Chinese media speculation about his appearance."
https://www.koreaherald.com/article/3640743,Kim Soo-hyun loves dark colored outfits,2014-06-09,https://wimg.heraldcorp.com/content/default/2014/06/09/20140609001489_0.jpg?type=h&h=240,"The fashion style of Korean heartthrob Kim Soo-hyun rarely stands out. The colors are basic and the designs are simple. But he never fails to give off a chic vibe that can hardly be copied by others. At formal events, Kim mostly chooses a simple dandy look. During the fan meeting tour event in Asian countries earlier this year, Kim wore dark suits that delivered a high-class air. Kim showed off a casual look only once at a formal event. Kim matched the jeans with a light-beige cardigan and curled his hair a bit. When taking flights, however, Kim prefers comfortable casual outfits such as dark jeans and a jacket. The hallyu star highlights his simple look with small items such as bags.              (OSEN)              (OSEN) ()",kimsoohyun,5.0,"The article is directly focused on Kim Soo-hyun's personal fashion choices and style preferences, specifically detailing his tendency to wear dark-colored outfits, his formal event attire, and his casual airport fashion. It provides specific examples of his clothing choices and describes his overall fashion approach, making it highly relevant to Kim Soo-hyun as the subject.",,Kim Soo-hyun's Understated Style Proves Less Is More,"From simple suits to casual comfort, Kim Soo-hyun's minimalist fashion choices are creating an inimitable signature look",Social,Daily fashion,"The article focuses on Kim Soo-hyun's personal style choices and fashion preferences, specifically highlighting his minimalist approach to everyday fashion through suits and casual wear, which falls under daily fashion observations rather than promotional or professional activities."
https://www.koreaherald.com/article/122371,‘Moon Embracing the Sun’ to be aired on Japanese state-run broadcaster in July,2014-05-30,https://wimg.heraldcorp.com/content/default/2014/05/30/20140530001279_0.jpg?type=h&h=240,"MBC historical drama “Moon Embracing the Sun” starring actor Kim Soo-hyun will be aired on Japanese state-run broadcaster NHK from July, Kim’s agency confirmed Friday. Actor Kim Soo-hyun NHK‘s recent scheduling of the Korean drama appears to be partly due to Kim’s rising popularity in other Asian countries after his latest television series “My Love from the Star” on SBS became a runaway hit in China. “My Love from the Star” was the nation‘s highest-rated drama series of 2012-2013, commanding a phenomenal 42.2 percent audience rating. The rom-com was broadcast on Japan’s cable TV channel KNTV and satellite channel NHK BS Premium. The satellite channel recently began to rerun the drama.  The drama began airing on the Japanese cable channel DATV on May 25, raising Japanese fans’ interest in Kim. “As his popularity shot up recently, we received a flood of requests for reruns of various dramas featuring him and exclusive interviews with influential news media,” a company official told Korean news agency Yonhap. The success of Kim’s dramas is expected to bring back the fading popularity of Korean dramas in Japan, Yonhap reported, since the aggravated ties between Korea and Japan has discouraged Korean dramas being aired on a major Japanese TV network. By Chung Joo-won ()",kimsoohyun,5.0,"The article is directly focused on Kim Soo-hyun, discussing two of his major dramas (""Moon Embracing the Sun"" and ""My Love from the Star"") and their broadcast in Japan. It specifically addresses his rising popularity in Asia, particularly Japan, and how his success is influencing Korean drama distribution in the Japanese market. The article primarily revolves around Kim's career achievements and impact.",,Kim Soo-hyun's Star Power Reignites Korean Drama Wave in Japan,"Rising popularity of Kim Soo-hyun prompts NHK to broadcast ""Moon Embracing the Sun"" amid renewed interest in Korean content",Acting,Drama/Series,"The article focuses on Kim Soo-hyun's impact through his drama ""Moon Embracing the Sun"" being broadcast on NHK in Japan, highlighting his influence in spreading Korean drama content internationally through his acting work."
