url,title,date,thumbnail,content,celebrity,relevance_score,relevance_reason,source,headline,subheading,category,subcategory,category_reason
https://www.koreaherald.com/article/28493,[팟캐스트] (22) 계속되는 드라마 표절 논란,2013-12-27,https://wimg.heraldcorp.com/content/default/2013/12/27/20131227001200_0.jpg?type=h&h=240,"[기사요약] 2013년 방송가엔 유난히 표절 의혹을 받는 드라마가 많았다. SBS '너의 목소리가 들려’와 tvN '나인’을 포함해 꽤 많은 작품들이 논란이 됐다. 특히 SBS '야왕'은 극본을 집필한 이희명 작가가 표절 의혹으로 한국방송작가협회로부터 제명당하면서 이슈가 되기도 했다. 전지현, 김수현이라는 호화 캐스팅에 시청률 20%를 넘나드는 SBS '별에서 온 그대' 역시 마찬가지다. 하지만 ‘별그대’ 제작사와 만화 ‘설희’의 강경옥 작가의 치열한 공방전에도 불구하고 2회 분만에 놀라운 시청률을 기록하는 듯 드라마는 승승장구하고 있다. More TV dramas accused of plagiarism  *Plagiarism: 표절  *Accused of:~로 비난받다 [1] After only its second episode, the newly aired SBS drama “My Love from the Star” featuring popular stars Kim Soo-hyun and Jun Ji-hyun (Gianna Jun) has found itself wrapped up in a heated plagiarism controversy with an ongoing Korean comic book series titled “Seol Hee,” which is based on a similar concept to the drama. *Featuring: ~주연의, ~가 출연하는 (starring)   *Found itself: ~하고 있다. (상황 표현)  *heated: 열띤 (heated controversy. Highly controversial)  *Ongoing: 현재 진행 중인. 연재되고 있는. [2] “My Love from the Star” is based on the historical “Gwanghae Journal” from the Joseon era that referenced mysterious UFO sightings. *reference: 언급  *sighting: 목격 (특이한 것, 잠깐 보는 것에만 사용) [3] The TV drama adapted the tale into a show that tells the story of “alien” in the appearance of a human named Do Min-joon ― played by Kim ― who doesn’t age and has been living in Korea for the past 400 years. *Adapt: 각색하다 (other meanings: 새로운 환경, 상황에 맞추다)   *In the appearance of: ~의 모습을 한 [4] The drama follows the life of Do, who is now living in present-day Korea, as he falls in love with famous, yet snobby actress Cheon Song-ee ― played by Jun. *Follows the life of: ~의 이야기를 풀어낸다. Tells the story of, depicts…  *Snobby: 거만한 (cocky) [5] The SBS drama has been accused of ripping off the concept from the “Seol Hee” comic book series by cartoonist and writer Kang Kyung-ok. After the airing of the drama, Kang publicly claimed the theft of her storyline on her blog. *rip off: 훔치다, (rip somebody off: 바가지 씌우다)  *claim: 주장하다 (state, argue) [6] “While the ‘Gwanghae Journal’ is something anyone can write about, the adaptation of the storyline of ‘a 400-year-old man who doesn’t age and lives in the present’ and a ‘story of lovers’ is what I wrote in ‘Seol Hee,’” she wrote. [7] Kang went on to claim that she found at least eight points of similarity between the drama and her comic book ― a series that the writer claimed to have been developing for seven years ― including the use of a famous person, eternal youth, an alien, rebirth and others. *develop: 구상하다, 이야기를 풀어나가다  *eternal:영원한 (everlasting) [8] “Although the atmosphere, the male and female characters and the order in which events took place are different, the core of the story is far too similar,” she explained. *core: 중심 [9] Despite public outcry by the author, a spokesperson from HB Entertainment ― the production company for “My Love from the Star” ― released a public statement claiming that the accusations are completely baseless and denied any knowledge of the “Seol Hee” comic books during the drama’s production process. *outcry: 격렬한 반응 [10] “We did not know of the comic ‘Seol Hee’ and it was certainly not something that we referenced for our production,” said the HB Entertainment official in news reports.  기사 전문: http://www.koreaherald.com/view.php?ud=20131224000709 팟캐스트: https://itunes.apple.com/kr/podcast/koliaheleoldeu-paskaeseuteu/id686406253?mt=2 팟빵: http://www.podbbang.com/ch/6638",kimsoohyun,5.0,"The article is highly relevant to Kim Soo-hyun as he plays the main protagonist Do Min-joon in ""My Love from the Star,"" which is the central focus of this article. The piece specifically discusses the plagiarism controversy surrounding this drama and directly mentions Kim Soo-hyun as part of the ""star-studded casting"" alongside Jun Ji-hyun. It also details his character's role as a 400-year-old alien who doesn't age, making him a key figure in the plagiarism debate discussed in the article.",,Kim Soo-hyun's New Drama Faces Plagiarism Storm,"Star actor Kim Soo-hyun's latest series ""My Love from the Star"" accused of copying storyline from popular comic book",Controversy,Plagiarism,"The article directly addresses plagiarism accusations against Kim Soo-hyun's drama ""My Love from the Star,"" claiming it copied its storyline from a comic book, making it a clear controversy case centered on plagiarism issues."
https://www.koreaherald.com/article/28659,More TV dramas accused of plagiarism,2013-12-24,https://wimg.heraldcorp.com/content/default/2013/12/24/20131224000749_0.jpg?type=h&h=240,"After only its second episode, the newly aired SBS drama “My Love from the Star” starring popular stars Kim Soo-hyun and Jun Ji-hyun (Gianna Jun) has found itself wrapped up in a heated plagiarism controversy with an ongoing Korean comic book series titled “Seol Hee,” which is based on a similar concept to the drama. “My Love from the Star” is based on the historical “Gwanghae Journal” from the Joseon era that referenced mysterious UFO sightings. The TV drama adapted the tale into a show that tells the story of “alien” in the appearance of a human named Do Min-joon ― played by Kim ― who doesn’t age and has been living in Korea for the past 400 years. The drama follows the life of Do, who is now living in present-day Korea, as he falls in love with famous, yet snobby actress Cheon Song-ee ― played by Jun. The SBS drama has been accused of ripping off the concept from the “Seol Hee” comic book series by cartoonist and writer Kang Kyung-ok. After the airing of the drama, Kang publicly claimed the theft of her storyline on her blog.   “While the ‘Gwanghae Journal’ is something anyone can write about, the adaptation of the storyline of ‘a 400-year-old man who doesn’t age and lives in the present’ and a ‘story of lovers’ is what I wrote in ‘Seol Hee,’” she wrote. Kang went on to claim that she found at least eight points of similarity between the drama and her comic book ― a series that the writer claimed to have been developing for seven years ― including the use of a famous person, eternal youth, an alien, rebirth and others. “Although the atmosphere, the male and female characters and the order in which events took place are different, the core of the story is far too similar,” she explained. Despite public outcry by the author, a spokesperson from HB Entertainment ― the production company for “My Love from the Star” ― released a public statement claiming that the accusations are completely baseless and denied any knowledge of the “Seol Hee” comic books during the drama’s production process. “We did not know of the comic ‘Seol Hee’ and it was certainly not something that we referenced for our production,” said the HB Entertainment official in news reports. Although no legal action has been taken by either party, the issue of plagiarism has been a long-standing hot-button issue in the Korean entertainment industry, by both the accusers and the accused. Although many people take it upon personal instinct whether to judge an idea or concept as having been the victim of intellectual theft, the harsh reality is that it’s almost impossible to define, let alone prove, plagiarism. In the past, many popular Korean dramas have come under fire of plagiarism accusations such as “Secret Garden,” “Five Fingers,” “Greatest Love,” “Queen Sun Deok” and even the megahit 2009 spy drama “Iris,” starring Lee Byung-hun and Kim Tae-hee. In 2009, novelist Park Chul-joo first filed a suit against Taewon Entertainment ― the production company of KBS TV drama “Iris” ― claiming the plot of the drama had copied scenes from his novel. However, after deliberation, the Seoul Central District Court sided with Taewon Entertainment, claiming that although some of the scenes were similar, it was not “similar enough” to be considered plagiarism. A year later, another writer ― referred to only as Mr. Lee ― filed another lawsuit against the drama’s producers, claiming that some of the storyline had been plagiarized from one of his novels, infringing on the text’s copyright. However, after years of fighting, the courts eventually dismissed that lawsuit in August, stating that the scenes the producers of “Iris” were accused of plagiarizing were in fact “abstract ideas,” which are not afforded protection of copyright laws. “When it comes to plagiarism in a legal sense, there are just too many blurred lines,” said pop culture critic Jung Duk-hyun. “There is so much cultural content being put out into the public nowadays, the overlapping of ideas is just inevitable. “These genres all have a certain formula, like the storyline about a man falling in love with a woman … we’ve all seen it so much we’ve gone numb,” he continued. In the case of “My Love from the Star,” the critic claimed that the fact that the storyline is based on the historic findings surrounding the “Gwanghae Journal” just makes it all that more difficult to definitively state that the TV drama indeed plagiarized Kang’s comic book series. By Julie Jackson ()",kimsoohyun,5.0,"The article is directly centered around a plagiarism controversy involving ""My Love from the Star,"" in which Kim Soo-hyun played the lead role of Do Min-joon. The article specifically mentions him by name and describes his character's role as a 400-year-old alien, making it highly relevant to Kim Soo-hyun's career and one of his most notable acting projects.",,Kim Soo-hyun's New Drama Faces Alien-Sized Plagiarism Storm,"Kim Soo-hyun's role as a 400-year-old alien in ""My Love from the Star"" sparks controversy as comic creator claims stolen storyline",Controversy,Plagiarism,"The article discusses a plagiarism claim against Kim Soo-hyun's drama ""My Love from the Star"" where a comic creator alleges the storyline about a 400-year-old alien was stolen from their work."
https://www.koreaherald.com/article/27944,Gianna Jun proves aging is good,2013-12-17,https://wimg.heraldcorp.com/content/default/2013/12/17/20131217000456_0.jpg?type=h&h=240,"Actress to return to small screen with Kim Soo-hyun on ‘My Love from the Star' With her long, lean legs, velvety hair, and sassy image, Jun Ji-hyun ― known as Gianna Jun in the U.S. and China ― has remained at the top of Korea’s entertainment scene for more than a decade. Ever since playing the protagonist in the smash-hit movie “My Sassy Girl” in 2001, Jun has been one of few actresses who can boast longevity through a handful of films and heaps of TV commercials. For a long time, she topped the surveys of men’s favorite actresses and, moreover, represented a new generation of Korean femininity ― pretty, outspoken and confident. On Wednesday the 32-year-old actress makes a return to the small screen after 14 years away. In “My Love from the Star” scheduled to air at 10 p.m. on Wednesdays and Thursdays on SBS, Jun portrays Cheon Song-ee, a top actress who doesn’t really know life outside of showbiz. After a string of scandals break out that drag her down to the status of a nobody, she falls in love with an “alien” ― played by Kim Soo-hyun ― who has lived in Korea for more than 400 years. Alongside Jun and Kim, a number of up-and-coming actors are co-starring in the drama, including Park Hae-jin as an avid admirer of Song-ee; Yoo In-na as Song-ee’s friend and nemesis; and Shin Sung-rok as a cold-blooded businessman. Unlike her last TV drama appearance on “Happy Together,” where she was the youngest of the bunch and relied on household-name actors such as Song Seung-hun and Lee Byung-hun, this time, Jun is the eldest of the leading actors. Kim, Yoo and Park all expressed their excitement in working with Jun, their senior. At the press conference Monday marking the launch of the drama, Jun showed off her maturity, and that she had more than a pretty face and a pin-up figure. After hitting recent box office home runs with “Berlin File” and “The Thieves,” she looked more laid back and confident than ever. “Aging definitely brought me to where I am. As I entered my 30s I began to think about what other people do ― get married, think about my career in a long term … those are what I have done, too,” said Jun, who married a banker last year. “I have come to acknowledge that I am a grown-up and that I need to go slow at this point and speed up at that. Thanks to the films’ success, I have the opportunity to focus on what I have chosen,” she said. Jun’s character of Song-ee ― the “star of Asia” ― is bold, blunt, and sometimes overly confident in situations that could easily make her look dumb. She drinks like a fish, swears like a sailor and does whatever she wants, including drunkenly pounding on other people’s doors in the middle of the night. This reminds viewers a lot of Jun’s character in “My Sassy Girl.” Jun would have refuted such claims in the past, but now she seems unperturbed. “Well, all the characters I have played come out from me and it is natural that they reflect pieces of me. I am not the kind of person who has multiple personas. It is natural that you may think that they look alike in a way,” Jun said. “But with the lines (written by star writer Park Ji-eun of ‘My Husband Got a Family’) and the environment (directed by Jang Tae-yoo of ‘Deep Rooted Tree’ and ‘Painter of the Wind’), I am sure I will be playing Cheon Song-ee effectively,” she said. Jun shared the spotlight with actor Kim, who rose to stardom after appearing on the MBC TV drama, “Moon Embracing the Sun” last year as a handsome and romantic king. Kim played Jun’s sort-of love interest in the movie “The Thieves.” “I have to admit that one of the main attractions of the drama was working with Jun,” Kim said. “On set, she really sets the atmosphere and she knows what to do. It really helps.” “Jun was the first person on the list for the Cheon character. But we all thought, ‘Hey, would Jun really take it?’ When she did, we couldn’t believe it. It was a true dream come true,” director Jang said. “It will be the best rom-com ever!” By Bae Ji-sook ()",kimsoohyun,5.0,"The article is highly relevant to Kim Soo-hyun as he is one of the main leads in ""My Love from the Star"" alongside Jun Ji-hyun. The article specifically mentions his role as an ""alien"" character in the drama and references his previous work with Jun in ""The Thieves."" It also includes direct quotes from Kim about working with Jun, and mentions his rise to stardom through ""Moon Embracing the Sun.""",,Kim Soo-hyun Reunites with 'The Thieves' Co-Star in Otherworldly Romance,Rising star Kim Soo-hyun plays a 400-year-old alien who falls for Korea's top actress in new SBS drama 'My Love from the Star',Acting,Drama/Series,"The article discusses Kim Soo-hyun's role in a new SBS drama series ""My Love from the Star"" where he plays a supernatural character (400-year-old alien), mentioning his reunion with a former co-star from ""The Thieves."""
https://www.koreaherald.com/article/27531,"“별에서 온 그대” 전지현, 14년만 드라마 컴백",2013-12-16,https://wimg.heraldcorp.com/content/default/2013/12/16/20131216001193_0.jpg?type=h&h=240,"배우 전지현이 16일 오후 서울 양천구 목동 SBS 사옥에서 열린 새 수목드라마 '별에서 온 그대(이하 별그대)' 제작발표회에서 오랜만의 드라마 출연에 긴장된다는 소감을 전했다. 전지현은 극 중 역할인 천송이는 한류 여신에서 인기가 추락하는 사건을 겪게 되지만 동시에 가장 코믹한 캐릭터라고 전했다. 14년만의 복귀작으로 주목을 받는 ‘별에서 온 그대’는 400년 전 조선시대부터 살고 있는 외계인 도민준(김수현 분)과 한류 스타 천송이의 로맨스를 중심으로 전개된다. ‘별에서 온 그대’는 오는 18일 오후 첫 방송 된다.   <관련 영문 기사>  Jun Ji-hyun makes comeback with TV drama  South Korea’s top actress Jun Ji-hyun said she was nervous about making a comeback with the upcoming drama “Man from the Stars” after a 14-year hiatus from the small screen. “I am to play the role of a top hallyu actress, Chun Song-yi, who falls from stardom, but the character is on the whole very comic,” said Jun at a press conference for the drama, held on Monday. The drama portrays a romance between Do Min-joon (Kim Soo-hyun), a handsome alien whose been alive since the Joseon era, and once-famous star Chun Song-yi, played by Jun. The drama “Man from the Stars” will kick off on Dec. 18. 　By Yoon Ha-youn, Intern reporter 　()",kimsoohyun,5.0,"The article is highly relevant to Kim Soo-hyun as he plays one of the main lead roles (Do Min-joon) in ""Man from the Stars"" alongside Jun Ji-hyun. His character is specifically described as a handsome alien who has lived since the Joseon era, making him a central figure in the drama's plot.",,Kim Soo-hyun Stars as 400-Year-Old Alien in Romantic Drama,"Kim Soo-hyun plays a mysterious being from the Joseon era who falls for a fading K-drama star in ""Man from the Stars""",Acting,Drama/Series,"The article discusses Kim Soo-hyun's acting role in the drama series ""Man from the Stars"" where he portrays a 400-year-old alien character, focusing on his performance in a television drama production."
https://www.koreaherald.com/article/27166,전지현-김수현 ‘별에서 온 그대’ 포스터 공개,2013-12-15,https://wimg.heraldcorp.com/content/default/2013/12/15/20131215000194_0.jpg?type=h&h=240,"연상연하 커플 전지현-김수현이 호흡을 맞춰 기대를 끌고 있는 SBS 새 수목드라마 ‘별에서 온 그대’의 포스터가 공개됐다. 포스터에는 무채색 도시와 하늘을 배경으로 검은 정장 차림의 전지현과 김수현이 포즈를 취하고 있다. 한류 스타 역을 맡은 전지현은 도도한 여배우 분위기를 자아내고 김수현은 차갑고 시크한 표정으로 시청자들의 궁금증을 증폭시키고 있다. ‘별그대’는 1609년(광해 1년), 조선왕조실록에 기록된 비행 물체 출몰에 관한 이야기를 바탕으로 한 로맨스 드라마다. 400년 전 지구에 떨어진 외계남 도민준과 왕싸가지 한류여신 톱스타 천송이의 기적과도 같은 달콤 발랄 로맨스를 그릴 예정이다. 오는 18일 밤 10시 첫 방송.   <관련 영문 기사>  Posters of SBS new series released   Three posters for SBS’ upcoming series “Man from the Stars” were unveiled on the broadcaster’s official website Sunday On the posters, Jun Ji-hyun and Kim Soo-hyun, who play the main characters in the much-anticipated drama, pose in front of a background of the stars in the sky and city scenes wearing a black dress and a suit. “Man from the Stars” has drawn much attention from the public as it is the 31-year-old Jun’s first TV drama in 14 years. The series portrays a good-looking alien, Do Min-joon (Kim Soo-hyun), who has lived in Korea since the Joseon era. Four centuries after his arrival, he falls in love with top hallyu actress Chun Song-yi, played by Jun Ji-hyun. The first episode is set to air on Dec. 18. ()",kimsoohyun,5.0,"The article is directly about Kim Soo-hyun, discussing his leading role in ""Man from the Stars"" (별에서 온 그대). It describes his character Do Min-joon, his pairing with Jun Ji-hyun, and includes details about his appearance in the drama's promotional posters. This is one of Kim Soo-hyun's most notable works that significantly boosted his career as a leading actor.",,Kim Soo-hyun Stars as Time-Traveling Alien in Romantic Drama,"Kim Soo-hyun and Jun Ji-hyun pair up in ""Man from the Stars,"" a tale of forbidden love between a 400-year-old alien and a modern-day actress",Acting,Drama/Series,"The article discusses Kim Soo-hyun's starring role in the drama series ""Man from the Stars"" where he plays a time-traveling alien character opposite Jun Ji-hyun, focusing on his acting work in a television drama production."
https://www.koreaherald.com/article/23395,Yoo In-na joins ‘Man from the Stars’ cast,2013-10-29,https://wimg.heraldcorp.com/content/default/2013/10/29/20131029000506_0.jpg?type=h&h=240,"Actress Yoo In-na has joined the cast of SBS television series “Man from the Stars” alongside A-list actors Kim Soo-hyun and Jun Ji-hyun. The series portrays a good-looking alien, Do Min-joon (Kim Soo-hyun), who has been living in Korea since the Joseon era. Four centuries later, he falls in love with top hallyu actress Chun Song-yi, played by Jun Ji-hyun. Yoo plays the role of her best friend since childhood, Yoon Se-mi, who is torn between being Song-yi’s best friend and being jealous of her success and love life at the same time. “I am honored to be joining such a fantastic production team for the television series,” Yoo In-na said in a statement. “I look forward to working together with such amazing actors.” “Man from the Stars” features scriptwriter Park Ji-eun, known for her part in popular television series “Queen of Reversals” on MBC and “You Who Rolled in Unexpectedly” on KBS2, and producer Jang Tae-yoo, who has worked on SBS hit series “War of Money” and “Deep-rooted Tree.” The series is slated to air in December. By Cha Yo-rim ()",kimsoohyun,5.0,"The article is directly focused on a major drama starring Kim Soo-hyun as the male lead character Do Min-joon. It describes his central role as an alien who falls in love with a human actress, making him one of the two main protagonists of ""Man from the Stars."" This is highly relevant to Kim Soo-hyun's career and acting work.",,Kim Soo-hyun Stars as Time-Traveling Alien in Epic Love Story,"Acclaimed actor Kim Soo-hyun leads star-studded cast in supernatural romance ""Man from the Stars"" alongside Jun Ji-hyun",Acting,Drama/Series,"The article discusses Kim Soo-hyun's leading role in a television drama series ""Man from the Stars"" where he plays a supernatural character (time-traveling alien) alongside actress Jun Ji-hyun. This clearly falls under acting work in a drama series."
