url,title,date,thumbnail,content,celebrity,relevance_score,relevance_reason,source,headline,subheading,category,subcategory,category_reason
https://www.koreaherald.com/article/1202647,"K-pop stars return from military service, top actors enlist",2017-01-10,https://wimg.heraldcorp.com/content/default/2017/01/10/20170110001012_0.jpg?type=h&h=240,"This year will see the return of K-pop idols as they complete their compulsory military service. Kim Hyun-joong of SS501 will be discharged on Feb. 11, while his bandmate Park Jung-min will leave the Army on July 1. Both members of TVXQ will return to civilian life this year -- Yunho on April 20 and Changmin on Aug. 18. Yoochun of JYJ is also scheduled to be discharged from the military on Aug. 26. Eunhyuk, Donghae, and Siwon of Super Junior will be discharged on July 12, July 14 and Aug. 18, respectively. Lee Seung-gi, who joined the military with the release of the single “I‘m Going to the Military,” will be discharged on Oct. 31. Meanwhile, many of the stars born between 1986 and 1988 will give up their celebrity lifestyle to fulfill their mandatory military duty this year. Some of the most beloved actors, including Kim Soo-hyun, Lee Min-ho and Jang Keun-suk are expected to start their military service. Joo Won, Seo In-guk and Ji Chang-wook have also indicated their intention to join the Army this year. Born in 1986, Yoo Ah-in will need to undergo another physical exam in March to determine whether he will enter active duty or reservist duty. This year will see K-pop stars Junsu of JYJ and T.O.P of Big Bang enter the police force on Feb. 9. Kim Hyung-jun of SS501 will join them, though the exact date is yet to be set. In a recent press conference, Kyuhyun of Super Junior said he will enlist this year as the last one in the group. Born in 1988, G-Dragon of Big Bang may also join T.O.P. By Kim So-yeon ()",kimsoohyun,4.0,"The article directly mentions Kim Soo-hyun as one of the ""most beloved actors"" expected to start their military service that year, grouping him with other prominent actors like Lee Min-ho and Jang Keun-suk. While he's not the main focus of the article, his inclusion represents a significant mention regarding his upcoming military enlistment.",,Kim Soo-hyun Among Top Korean Stars Set for Military Duty in 2017,Beloved actor Kim Soo-hyun joins Lee Min-ho and other A-list celebrities preparing to trade stardom for military service this year,Social,Military Service,"The article focuses on Kim Soo-hyun's upcoming mandatory military enlistment, which is a social obligation for South Korean male citizens. The news discusses his preparation to fulfill his national duty alongside other Korean celebrities, making it a social matter rather than an entertainment or career-related topic."
https://www.koreaherald.com/article/1185454,Most anticipated Hallyu stars of 2017 in China,2016-12-21,https://wimg.heraldcorp.com/content/default/2016/12/21/20161221000865_0.jpg?type=h&h=240,"Korean celebrities Kim Soo-hyun, Jun Ji-hyun, Song Joong-ki and Yoona were selected as Hallyu stars to look out for in 2017 in a survey conducted by Chinese media outlets. In a joint survey by Chinese newspaper People’s Daily and Korea’s Customers Council, an additional 10 Hallyu stars, including boy bands EXO, Big Bang and NCT Dream, were picked as the most anticipated stars of 2017. Some 307,520 people participated in the survey. Actors Kim Soo-hyun, Jun Ji-hyun and Song Joong-ki gained fame in China through pan-Asian hit dramas “My Love from the Star” and “Descendants of the Sun,” the Customers Council said. “Despite the strong anti-Hallyu measures recently taken by the Chinese government, the Chinese public’s interest in Hallyu stars has not died down,” said Jeon Jae-ho, head of the council. By Rumy Doo ()",kimsoohyun,5.0,"The article directly discusses Kim Soo-hyun as one of the most anticipated Hallyu stars in China for 2017, specifically mentioning his fame gained through the drama ""My Love from the Star."" He is named in the first sentence and referenced again when discussing his impact in China, making him one of the central figures in the article.",,China Can't Get Enough of Kim Soo-hyun Despite Government Pushback,"Kim Soo-hyun tops Chinese media survey of most anticipated Hallyu stars for 2017, alongside other Korean entertainment powerhouses",Social,Social Recognition,"The article focuses on Kim Soo-hyun's popularity and recognition in China, specifically highlighting his ranking in a Chinese media survey about most anticipated Hallyu stars, which reflects his social standing and public reception in the Chinese market despite government restrictions on Korean entertainment."
https://www.koreaherald.com/article/970431,"Korea, the republic of chicken",2016-05-27,https://wimg.heraldcorp.com/content/default/2016/05/27/20160527001233_0.jpg?type=h&h=240,"""Chicken Republic” refers not just to the abundant chicken eateries in Korea, but also shows how the fowl has affected the nation’s food culture and industrial map.  Over the decades, chicken has evolved into everyday comfort food and it has even become representative of Korea’s food culture. According to latest statistics, each Korean consumes an average of 15.4 kilograms of chicken a year. They are used in numerous dishes ranging from samgyetang (chicken in broth) to dakbokeumtang (chicken stewed in spicy sauce). But at the core of the meat’s popularity is the Korean-style fried chicken, which combines western cooking techniques and oriental seasonings to suit the palate of the Korean consumers. This fusion dish, which differs from traditional Korean chicken recipes, is referred to as “chikin (fried chicken)” instead of the Korean equivalent “dak twigim.” Chicken has also grown in popularity over recent years due to the rise of “chi-maek,” a word that combines chicken and beer. “Inviting somebody to have chi-maek carries a completely different tone from suggesting other get-togethers,” said Jeon Seung-wook, a 34-year-old office worker. “While it is filling enough to be counted as a full meal, chicken is much more casual as it is served in fully cooked pieces, allowing people to focus more on conversation.” This easygoing mood, along with the affordable price, is what makes chicken accessible to workers who get-together on weeknights or families and even single households looking for an easy home-delivery meal. Chicken joins in K-food wave Given its steady demand and frequent media exposure, chicken has become a popular item of the Korean culinary wave, especially in neighboring China. It was the hit SBS drama “My Love from the Star” that aired in 2013-2014 which brought Korean-style chicken to the attention of the Chinese public. After the release of a scene in which the drama’s heroine Jun Ji-hyun cheered up over chi-maek, holding a chicken drumstick in one hand and a cup of beer in the other, Chinese fans queued for hours at Korean chicken stores. Travel agencies immediately added chicken meals to their tourist programs, while chicken companies and regional governments mulled using chicken as a cultural promotion tool. In March this year, Incheon City made headlines by hosting a chicken and beer street promotion for 4,500 Chinese visitors who consumed some 3,000 chickens in one sitting. “Despite its western-based origin, chicken is now quite fit to represent Korea’s popular food culture, especially in a foreigner’s perspective,” said Kim Sook-hyun, a Korean female residing in New York. She previously spent several years in Berlin, Germany. Although chicken is familiar to them, westerners tend to be intrigued by the Korean twist such as the spicy sauces, she explained. “In fact, one of the things that I missed most about home during my stay in Europe was seasoned spicy chicken, not tteokbokki or any other conventional Korean-style snacks,” she added. “It was the menu that reminded me of home -- that existed in so many parts of my memory back there, so why wouldn’t I see it as Korean food?” Chicken game of the chicken sellers While overseas demand has opened up new doors for Korea’s chicken industry, it has also egged on competition in the already saturated market. According to the Statistics Korea and Fair Trade Commission early this year, Korea’s chicken market currently stands at 5 trillion won ($4.2 billion) in size, comprising of some 40,000 stores and 300 franchise brands. The number of stores exceeds the global total of fast food giant McDonald’s or the No. 1 chicken franchise Kentucky Fried Chicken. The former held 36,525 stores worldwide as of last year and the latter 18,875 as of 2014. If non-franchise owner stores and beer pubs selling chicken menus are included, the number of chicken sellers in Korea is likely to be much higher than the commission’s figures. This oversupply has inevitably led to a mass fallout. Seoul Metropolitan Government data in February showed that the number of chicken stores in the city soared by 38 percent in 2010-2015, but an equal number also closed down within the first three years in business. Despite this trend, aspiring owner-operators still opt to open such stores as it seems a plausible way of creating income on limited capital, given the simple recipe and menu Maintenance and personnel expenses are also lower compared to other restaurant businesses, especially in the case of delivery-only stores. “Our country is like a chicken republic, where elderly retirees have no other way than opening a (chicken) store, regardless of their occupational skills,” said President Park Geun-hye during a financial strategic meeting last month. Her remarks were made in support of a labor bill permitting the dispatch of elderly workers to correlated small and medium-sized companies. However, it also highlights the excessive boom of the market. Observers noted that those who seek to open such businesses should recognize the tough market situation before hastily opening a chicken franchise store. “Franchise headquarters would boast guaranteeing the operator a certain monthly income, but these stated figures often turn out to be delusive,” said an official of the FTC. “One also has to consider the surrounding elements, such as the number of competing stores in proximity and the public image of the franchise brand itself.” By Bae Hyun-jung ()",kimsoohyun,4.0,"The article directly references ""My Love from the Star"" (2013-2014), a drama that significantly impacted chicken consumption in China. Kim Soo-hyun was one of the main stars of this drama, though he's not mentioned by name. The article specifically discusses how his co-star Jun Ji-hyun's chicken-eating scene sparked a chicken craze in China, which was a major cultural phenomenon associated with the drama he starred in.",,Kim Soo-hyun's Drama Sparked China's Chicken Craze,"How a single scene of Kim Soo-hyun's co-star eating Korean fried chicken in ""My Love from the Star"" created a food phenomenon across Asia",Acting,Drama/Series,"The article discusses the cultural impact of Kim Soo-hyun's drama ""My Love from the Star"" and how a specific scene from the series influenced food trends in China and across Asia, making it primarily about the drama's influence rather than the actor's personal activities or promotions."
https://www.koreaherald.com/article/960918,K-pop stars and 'character education',2016-05-16,https://wimg.heraldcorp.com/content/default/2016/05/16/20160516001066_0.jpg?type=h&h=240,"Hallyu celebs undergo intensive training to present polished image K-pop production companies are notorious for the rigorous training of their entertainers who undergo years of dance and vocal training before they enter the competitive market. 　When singers started appearing on TV dramas and films, acting classes also became essential. And when the K-pop wave went global, foreign language classes were added into the already harsh training regimes.　 　Now, in an age when K-pop stars’ every word and action are prone to scrutiny worldwide, agencies have started to focus on “character education,” which involves giving the singers comprehensive education in subjects ranging from basic etiquette to history and international politics. 　Minding manners 　 DSP Entertainment, which manages girls groups Kara and Rainbow, conducts internal education on what it calls “character development and basic etiquette.” 　“We teach our trainees how to greet people properly and how to address audiences and behave on TV shows,” said an official from the company. 　At Starship Entertainment, home to K-pop groups Sistar and Monsta X, trainees are taught how to speak politely and eloquently. 　“Our trainees have to follow rules like not swearing, not slurring speech and greeting people with loud, clear voices,” said an official there. “Before each team debuts, we offer specialized courses on giving interviews, which includes speaking coherently and responding to unexpected questions.” 　The agency also tends to their entertainers’ mental well-being and offers regular counseling.　 　JYP Entertainment, the K-pop powerhouse that represents groups like Twice, 2PM and Wonder Girls, has strict policies concerning schoolwork and “moral character.” 　“Our head producer Park Jin-young really values school and good morals,” said an official there. “Our trainees are not allowed to miss school unless absolutely necessary,” he said, while most other companies tend to prioritize training over school attendance. 　Bigger issues -- history, politics 　In areas that require more expertise, agencies invite university professors to give lectures or require entertainers to attend classes at the Korea Creative Content Agency’s Popular Culture and Arts Center, which began offering a “character education” program for K-pop singers and actors last year. 　The program includes classes on historical issues and cultural sensitivities, which are becoming increasingly important for K-pop celebrities to understand, according to the center’s director Jung Tae-sung. 　“In Islamic countries, for example, it’s taboo to hug fans or come into physical contact with them,” said Jung. “K-pop stars are branching out into more countries than ever now. They’re representing Korea abroad, which is why we felt it was necessary to offer a proper educational program.” 　For the Korean audience, history is a particularly delicate subject. Just last week, members Sulhyun and Jimin of girl group AOA drew flak when they were unable to identify a picture of An Jung-geun, a famous Korean independence activist. 　In 2014, actors Kim Soo-hyun and Jun Ji-hyun, stars of the hit drama series “My Love from the Star,” were heatedly criticized by local fans when they appeared on an ad for a Chinese mineral water brand that bears the Chinese name of Mt. Baekdusan, which lies on the border between Korea and China. 　Celebrities who show that they’re aware of historical issues, on the other hand, gain a huge boost in their public image. Last month, when actress Song Hye-kyo announced that she had refused to appear in an ad for Mitsubishi Motors, a company that had used Korean slave labor during World War II, local fans and media heaped praise on her. 　Knowledge of diplomatic relations is also important for K-pop groups, especially those that have members of different nationalities, Jung noted. 　In January, for example, when girl group Twice’s Taiwanese member Tzuyu held up a Republic of China flag on a television show, she was met with outrage from fans in China who condemned it as a gesture promoting the independence of Taiwan. The scandal prompted Tzuyu to upload a video apology, in which she stated “China and Taiwan are one.”　 　The Popular Culture and Arts Center also offers classes on subjects like social media usage and managing stress, essential for celebrities who are exposed to public opinion that is often negative, said Jung. Also available are activities involving crafts and personal storytelling to “enhance artistic creativity.” By Rumy Doo ()",kimsoohyun,3.0,"The article mentions Kim Soo-hyun specifically, but only briefly in one instance regarding a 2014 controversy where he and Jun Ji-hyun were criticized for appearing in a Chinese mineral water advertisement that used the Chinese name for Mt. Baekdusan. While this example illustrates the importance of cultural and historical sensitivity for Korean celebrities, Kim Soo-hyun is not a central focus of the article, which more broadly discusses character education and training in the K-pop industry.",,Kim Soo-hyun's Chinese Ad Sparks Historical Controversy,Korean superstar Kim Soo-hyun faces backlash over mineral water advertisement tied to territorial dispute with China,Controversy,Political Controversy,"The article discusses backlash and controversy surrounding Kim Soo-hyun's appearance in a Chinese advertisement that involves a territorial dispute between China and Korea, making it primarily a political controversy rather than just a brand activity."
https://www.koreaherald.com/article/959461,Cliff from ‘My Love from the Star’ restricted for safety concerns,2016-05-13,https://wimg.heraldcorp.com/content/default/2016/05/13/20160513001031_0.jpg?type=h&h=240,"The famous cliff from 2014 hit-TV drama “My Love from the Star” has been temporarily closed to the public over safety concerns since April 22. 　 According to the Incheon Metropolitan City, the cliff in Songdo was graded worrisome D and E in its latest safety examination. Experts have reportedly warned that the cliff face was unstable and could result in deadly rock falls due to having been previously used as a quarry up to 1994. However, the city is known to have made exceptions for mass Chinese tour groups. The Incheon Tourism Organization said, “On occasions when the tourists make a group request through their travel agency, we have allowed short visits arranged in a way so that they were not too near the hazardous parts.”　　 The Incheon city government plans to conduct meetings with relevant authorities on Monday to bolster safety measures and reopen the area as quickly as possible. It also intends to brainstorm ways to transform the mountain on which the cliff is located into a distinguished hallyu theme park. Building a cafe in the theme of “My Love from the Star” and a place where tourists can make wishes with “binyeo,” the traditional Korean hairpin featured in the TV drama, are a few of the ideas that are under review. Offering rides in old-style Korean sedan chair is also being considered. Starring actors Jun Ji-hyun and Kim Soo-hyun, “My Love from the Star” was a phenomenal success in 2014, both domestically and abroad. The Songdo rock mountain is affectionately nicknamed the Cheon-Do cliff by drama fans, as it is where the lead female character Cheon Song-yi was rescued by her male counterpart Do Min-joon from a near-death experience. By Lim Jeong-yeo ()",kimsoohyun,4.0,"The article is highly relevant to Kim Soo-hyun as it discusses a significant filming location from ""My Love from the Star,"" a drama in which he played the lead male role of Do Min-joon. The cliff mentioned was featured in a key scene where his character rescued the female lead, contributing to the drama's success. The article specifically names Kim Soo-hyun as one of the main stars of this phenomenally successful 2014 drama.",,Kim Soo-hyun's Iconic Drama Cliff Deemed Too Dangerous for Fans,"Famous mountain location where Kim Soo-hyun filmed dramatic rescue scene in ""My Love from the Star"" closes over safety concerns",Acting,Drama/Series,"The article discusses a filming location from Kim Soo-hyun's drama ""My Love from the Star"" and its current status, specifically focusing on a cliff where a dramatic scene was filmed. The news is directly related to his past drama work and its lasting impact on tourism."
https://www.koreaherald.com/article/944678,Pharmaceutical firms expect stronger sales during China's Labor Day holiday,2016-04-28,https://wimg.heraldcorp.com/content/default/2016/04/28/20160428001063_0.jpg?type=h&h=240,"Korean pharmaceutical companies are strengthening their promotions to sell more of their mainstay products to incoming Chinese tourists during China's Labor Day holiday, industry sources said Thursday. Local pharmaceutical firms such as Handok and Kyung Nam Pharm have rolled up their sleeves to attract as many Chinese tourists as possible during the three-day national holiday that starts on April 30, they said. Handok has supplied more of its Ready Q product for relieving hangovers in major outlets in Myeongdong, central Seoul. The mango-flavored product became popular among Chinese people after it recently debuted in a cable TV program in China. In Myeongdong shops, Handok saw sales of Ready Q jump 158 percent in February from a month earlier and 452 percent in March, a company spokesman said. Kyung Nam Pharm expects robust sales of its Lemona C vitamin powder as it carries the face of movie star Kim Soo-hyun on it. Kim is best known as ""the man from the star"" among Chinese fans due to the popular TV series ""My Love from the Star"" that aired in 2013. Sales have been rising since 2014, when the face of the 29-year-old Hallyu star appeared on the packet of the vitamin product, a Kyung Nam spokesman said. As Hallyu, or the Korean Wave, has gained bigger popularity recently helped by Korean cultural products including K-pop and TV series, local companies have increased efforts to relate their products to the trend to boost sales. (Yonhap)",kimsoohyun,5.0,"The article directly discusses Kim Soo-hyun's role as a brand ambassador for Kyung Nam Pharm's Lemona C vitamin powder, specifically mentioning his popularity in China due to ""My Love from the Star"" and how his face on the product has helped increase sales since 2014. The article demonstrates his significant commercial influence in the Chinese market as a Hallyu star.",,Kim Soo-hyun's Star Power Turns Vitamin C into Gold for Korean Pharma,Chinese tourists flock to buy vitamin powder endorsed by Kim Soo-hyun as pharmaceutical companies capitalize on Korean Wave during Labor Day holiday,Promotion,Brand activities,"The article focuses on Kim Soo-hyun's commercial influence as a brand endorser for a vitamin C product, highlighting how his celebrity endorsement has driven Chinese tourists to purchase the pharmaceutical product during a holiday period, demonstrating his marketing power in the industry."
https://www.koreaherald.com/article/894274,Boom of Korean TV series grips Argentina,2016-03-11,,"South Korean TV dramas are captivating viewers in Argentina, another sign that the popularity of ""hallyu"" is rising in Latin America. ""Stairway to Heaven"" starring Kwon Sang-woo and Choi Ji-woo has recently been hovering around fifth in the local viewership ranking, according to the Korean Cultural Center in the South American country, with the SBS drama first hitting the air on Argentina's largest private television network Telefe on Feb. 10. Hallyu, or the Korean Wave, refers to the popularity of Korean television shows and pop songs around the world. Boosted by the drama's success, Telefe will soon broadcast two more Korean TV series -- ""My Love from the Star"" and ""Angel Eyes"" -- the center said in a release Thursday. ""My Love from the Star,"" starring actor Kim Soo-hyun and actress Jun Ji-hyun, became a huge sensation across Asia in 2014. The SBS drama tells the story of an alien from outer space who falls in love with a top actress. ""Angel Eyes,"" broadcast in 2014 on the same channel, is about two former lovers, who were forced to separate due to painful family issues, meeting each other again 12 years later. The center said another SBS series, ""Secret Garden,"" also captivated Argentine viewers when it was shown on the country's cable channel Magazine last year. It was the first Korean drama to be shown in Argentina. Reflecting this trend, the country's most influential daily Clarin on Wednesday allocated two pages to cover the recent wind of Korean TV dramas blowing into the country. The newspaper said the overseas success of Korean dramas is in large part attributable to Seoul's aggressive cultural policy, and this has generated a synergy effect in various fields of pop culture, such as films, K-pop and dramas, according to the center. (Yonhap)",kimsoohyun,5.0,"The article directly mentions Kim Soo-hyun and his starring role in ""My Love from the Star,"" highlighting how this drama was a huge sensation across Asia in 2014 and was selected for broadcast in Argentina, demonstrating his international influence and the global reach of his work.",,Kim Soo-hyun's Alien Love Story Conquers Argentina,"Kim Soo-hyun's hit drama ""My Love from the Star"" leads Korean TV wave sweeping across Latin America",Acting,Drama/Series,"The article focuses on Kim Soo-hyun's drama ""My Love from the Star"" and its success in international markets, specifically its popularity in Argentina and Latin America, demonstrating the spread of Korean television content globally."
