url,title,date,thumbnail,content,celebrity,relevance_score,relevance_reason,source,headline,subheading,category,subcategory,category_reason
https://www.koreaherald.com/article/10011404,Disney+ offers sneak peek at 2025 lineup of Korean originals,2024-11-21,https://wimg.heraldcorp.com/content/default/2024/11/21/20241121050111_0.jpg?type=h&h=240,"SINGAPORE — Disney+ offered a sneak peek at its highly anticipated lineup of Korean originals for 2025 during a series of press conferences, giving fans of Korean content an early look at next year’s star-studded releases.
As part of the Disney Contents Showcase Asia Pacific 2024 event held at the Sands Expo & Convention Center on Thursday, the platform unveiled details about several upcoming titles, with the slate including ""Unmasked,"" ""Hyper Knife,"" ""Knock-Off,"" ""Low Life"" and ""Nine Puzzles.""
""Unmasked,"" set to premiere in January 2025, stars Kim Hye-soo, one of Korea’s most celebrated actors, and follows a team of investigative journalists uncovering society’s most heinous crimes.
“The story of people pursuing justice and truth might seem shallow at first glance, but our work incorporates realistic and serious episodes, including topics like fake news,” Kim said at the event. “To make the message accessible, we’ve infused wit and lightened the tone. Each episode offers a distinct mood, combining entertainment with purpose,” she added.
""Low Life,"" featuring Ryu Seung-ryong and Lim Soo-jung, delves into the tale of men vying to recover a newly unearthed treasure. The series has drawn attention under the direction of Kang Yoon-sung, renowned for his work on acclaimed projects like ""Roundup"" and Disney+ original ""Casino.""
“While working on 'Casino,' Disney gave me a great deal of creative freedom,” Kang shared, noting the new project reflected the creator’s vision throughout.
Kang highlighted the “living, breathing characters” as the heart of the series. “Our drama features a diverse cast of characters with unique stories. They assert themselves and move as if they’re alive. The actors worked hard to interpret and bring these roles to life, and I made sure not to overlook any of their efforts,” Kang said.
In ""Hyper Knife,"" Park Eun-bin, acclaimed for her role in ""Extraordinary Attorney Woo,"" takes on the role of a rogue neurosurgeon performing illegal surgeries.
Speaking about the challenging role, Park noted, “Rather than relying on calculated precision, I aimed to evoke emotional outbursts instinctively on set.”
""Knock-Off"" brings together Hallyu stars Kim Soo-hyun and Cho Bo-ah in a tale of a destitute man who dives into the world of counterfeit trade.
Cho shared that the series’ setting, spanning South Korea during the 1990s and 2000s, intrigued her and motivated her to join the project. Meanwhile, Kim expressed interest in his character’s evolution from an ordinary office worker to a salesperson and ultimately a renowned figure in the counterfeit goods industry.
""Nine Puzzles,"" the final series that was introduced as part of Disney+'s slate of 2025 Korean releases, will star Kim Da-mi and Son Suk-ku in a gripping mystery. The story unravels as Son’s character becomes entangled in a chilling case involving a mysterious serial killer.
Yoon Jong-bin, the director of ""Nine Puzzles,"" had previously mentioned that he would not produce another series after the challenging experience of working on the Netflix series ""Narco-Saints."" However, he decided to return to directing for this project because of the compelling power of the script.
""I was physically and mentally exhausted, so I initially didn't plan on taking on another project. I was actually considering doing a film next when I was offered the script for 'Nine Puzzles.' ...But the story was so immersive, and I couldn’t predict what would happen next. It’s about chasing a serial killer, and even I kept thinking, ‘This person must be the culprit,’ only to be proven wrong again and again.""",kimsoohyun,4.0,"The article directly mentions Kim Soo-hyun as one of the lead actors in the upcoming Disney+ series ""Knock-Off,"" where he plays a character who transitions from an office worker to a prominent figure in the counterfeit goods industry. While he's not the main focus of the entire article, which covers multiple upcoming Korean series, there is a specific paragraph dedicated to discussing his involvement in the project and his character's arc.",,Kim Soo-hyun Takes on Counterfeit Crime in Disney+'s Most Ambitious Korean Drama Yet,"Hallyu superstar Kim Soo-hyun leads 'Knock-Off,' a gritty series about an ordinary man's descent into Korea's dangerous counterfeit trade world of the 1990s",Acting,OTT,"The article discusses Kim Soo-hyun's new acting project ""Knock-Off"" on the OTT platform Disney+, where he plays the lead role in a drama series about counterfeit trade in 1990s Korea."
https://www.koreaherald.com/article/10011393,"Disney+ unveils Asia-Pacific lineup for 2025, confirms season 2 of 'Moving'",2024-11-21,https://wimg.heraldcorp.com/content/default/2024/11/21/20241121050077_0.jpg?type=h&h=240,"SINGAPORE -- News that a second season of the Korean megahit series ""Moving"" is currently in development was among the slew of announcements made by The Walt Disney Company Asia Pacific Thursday regarding the upcoming slate of Disney+ Asia Pacific content.
""Moving"" is an action-fantasy series, but at its core, it is a coming-of-age story about friendship, family and human relationships told in a brand new way,"" said Carol Choi, executive vice president of original content strategy at The Walt Disney Company Asia Pacific, during a press conference held in Singapore on Thursday. The event was part of Disney Content Showcase APAC 2024, held from Wednesday to Thursday.
""With such incredible success, I am extremely pleased to officially announce today that we have begun development on 'Moving season 2.' We're still at a very early stage and we'll be sure to come back with more details when we're ready,"" said Choi.
During the event, Choi emphasized the power of Korean content, remarking that of Disney+'s 15 best-performing international original titles, based on views, nine are Korean titles.
She added that this year, Korean action drama ""A Shop For Killers"" has become the most viewed series on Disney+ in the Asia Pacific region, with Korean travel reality show ""Are You Sure?!,"" starring BTS stars Jimin and Jung Kook, becoming Disney+'s most viewed unscripted title in the region.
“Stories produced in the Asia Pacific (region) have become a staple in general entertainment consumption -- they are world-class productions, with a growing global resonance and deep passionate fandoms worldwide,” said Choi.
The platform also unveiled details about some of its 2025 lineup of Korean originals, which includes titles such as ""Unmasked,"" ""Hyper Knife,"" ""Knock-off,"" ""Low Life"" and ""Nine Puzzles.""
""Unmasked,"" starring Kim Hye-soo — one of the nation's most celebrated actors, known for her role in the hit series ""Signal"" and blockbuster films like ""Tazza"" — will follow a team of investigative journalists known for uncovering some of society’s most heinous crimes.
One of Disney+'s most anticipated Korean series for the new year is ""Knock-Off,"" which tells the story of a broke man who turns to the world of counterfeiting in an attempt to rebuild his life. The series will star Hallyu sensations Kim Soo-hyun and Cho Bo-ah as main leads.
Kim Da-mi and Son Suk-ku will star in ""Nine Puzzles,"" a classic whodunit in which Son becomes involved with a mysterious serial killer.
""Low Life,"" starring Ryu Seung-ryong and Lim Soo-jung, will follow the story of men who rush to salvage a recently discovered treasure. In ""Hyper Knife"" Park Eun-bin, known for playing Woo Young-woo in the hit series ""Extraordinary Attorney Woo,"" returns to the screen to play a neurosurgeon.
The event also introduced other Korean series for 2025 whose details remain yet undisclosed to the public -- including ""The Murky Stream"" starring Rowoon and Shin Ye-eun; ""The Manipulated"" starring Ji Chang-wook and Doh Kyung-soo; ""Tempest,"" starring Jun Gianna and Gang Dong-won; and ""Made In Korea,"" starring Hyun Bin and Jung Woo-sung.
On Wednesday, The Walt Disney Company also unveiled its 2025 global lineup, featuring 26 highly anticipated titles set to premiere in theaters and on Disney+. Among them is ""Avatar: Fire and Ash,"" one of Hollywood's most eagerly awaited sci-fi films.
During the announcement, concept artworks from the third installment of James Cameron’s acclaimed ""Avatar"" franchise was released, showcasing new creatures and introducing a new tribe called the Ash People. The film will center around Marine-turned-Na’vi leader Jake Sully (Sam Worthington), Neytiri (Zoe Saldana) and their family as they face the Ash People, who have become hostile after their civilization was destroyed in a volcanic eruption. ""Avatar: Fire and Ash"" is slated for release in theaters on Dec. 19, 2025.
In addition to ""Avatar,"" Disney announced sequels to popular Walt Disney Animation Studios films, including ""Moana"" and ""Zootopia, and revealed that ""Mufasa: The Lion King"" will premiere on Dec. 18 next year.
The computer-animated film will explore the origin story of Mufasa, Simba’s father, presenting him as an orphaned cub who meets Taka, an heir to a royal bloodline. Director Barry Jenkins expressed his excitement for the project via a video, calling Mufasa “an icon” and noting his joy in contributing to a legacy symbolizing wisdom and strong family bonds.
Other highlights from the event include ""Snow White,"" set to debut as a musical film in March next year. It was also announced that Lucasfilm’s ""Star Wars: Visions Volume 3"" will be debuting next year on Disney+.",kimsoohyun,3.0,"The article mentions Kim Soo-hyun specifically but only briefly, noting that he will star alongside Cho Bo-ah in the upcoming Disney+ series ""Knock-off"" as one of the main leads. While he is mentioned in the context of an important upcoming project, the article primarily focuses on Disney+'s broader Asia-Pacific content lineup and various other productions, making it only moderately relevant to Kim Soo-hyun specifically.",,Kim Soo-hyun Returns to Disney+ in High-Stakes Crime Drama,"Hallyu star Kim Soo-hyun leads anticipated 2025 series ""Knock-Off"" as a desperate man drawn into the dangerous world of counterfeiting",Acting,OTT,"The article announces Kim Soo-hyun's upcoming role in a new Disney+ series ""Knock-Off"" scheduled for 2025, which is a streaming platform (OTT) production. The news focuses on his casting and return to the streaming service as the lead actor in a crime drama."
https://www.koreaherald.com/article/3407255,[Music in drama] Legendary ballads fan alien romance,2024-06-03,https://wimg.heraldcorp.com/content/default/2024/06/03/20240603050464_0.jpg?type=h&h=240,"“My Love from the Star” was one of the most successful drama series 2013 -- as was its soundtrack. The series features a magical romance between Do Min-joon (Kim Soo-hyun), an alien pretending to be a human for hundreds of years after accidentally falling on Earth, and Chun Song-yi (Jun Ji-hyun, also known as Gianna Jun), a top actress who is spirited yet lonely. With its touching romance and well-timed comic scenes, the series garnered die-hard fans beyond Korea, reaching China, Japan, and many other countries. The drama, after its conclusion, was broadcast on the Japanese pay channel DATV, while in China, the Korean foods featured in the show gained huge popularity. Beside the storyline and the acting, the soundtrack was a key part of the series' charm. Every episode featured songs performed by cherished singers across generations, including tracks sung by the male lead, Kim Soo-hyun, himself. Sung Si-kyung, whose unforgettable timbre has made him one of Korea's most beloved ballad singers, composed and sang “Every Moment of You” for the soundtrack. With Sung’s soothing voice and heartwarming melody, the song remains popular even to this day. The lyrics, written by hitmaker Shim Hyun-bo, depict how Do Min-joon fell in love with Chun Song-yi: “And then, the moment I recognized you at a glance / Everything was clearly changing / My world divides into before and after knowing you” The song continues: “I hope I was present in every moment of yours / Just thinking about it makes my heart swell, I'm filled with you” Former Sistar member Hyolyn took part in the soundtrack as well. Although she is known for her powerful voice, she showcased a more tender and tearful voice in ""Good Bye."" The song begins gently, whistling the melody, gradually building up to a climax. The simple, repetitive melody captures the protagonists' fear of an impending separation against their will: “Love has come, but you say you're leaving, I've been waiting, but now I can't see you anymore.” ""My Love from the Star"" features the iconic track ""My Destiny"" by singer Lyn. Even after the drama ended, the song continued to be performed at award ceremonies and at special year-end stages. Lyn won the best soundtrack award for this song at the 50th Baeksang Arts Awards in 2014, a category that was newly established that year. Heartfelt declaration of love, delivered with Lyn’s deep voice, portrays the unbreakable bond between the two main characters despite ongoing trials – even transcending species: “You're the one my love, You are / You're my delight of all / You’re my everlasting love.” The lead actor Kim Soo-hyun sang two songs for the series, ""Promise"" and ""In Front of Your House."" Both songs are arranged to focus on Kim's voice. Especially notable is ""Promise,"" a remake of Lim Byeong-soo's 1984 song. Reinterpreted with acoustic guitar and Kim's gentle voice, the song reflects the situation of the two characters facing separation in episode 19: “On this night when the stars shine unusually bright / It makes me sad that you’re saying you’ll leave after this moment.”",kimsoohyun,5.0,"The article is highly relevant to Kim Soo-hyun as it discusses his leading role as Do Min-joon in ""My Love from the Star"" and specifically mentions his musical contributions to the drama's soundtrack, where he performed two songs (""Promise"" and ""In Front of Your House""). The article also details the drama's success and impact, which was a significant milestone in Kim Soo-hyun's career.",,Kim Soo-hyun's Alien Love Story Captivated Hearts and Charts,"From stellar acting to soulful singing, Kim Soo-hyun's dual talents helped make ""My Love from the Star"" a global K-drama phenomenon",Acting,Drama/Series,"The article focuses on Kim Soo-hyun's performance in the K-drama ""My Love from the Star"" and its success as a television series, highlighting his acting work as the main subject rather than other aspects of his career or personal life."
https://www.koreaherald.com/article/3387056,'Queen of Tears' riding high on Netflix chart,2024-05-06,https://wimg.heraldcorp.com/content/default/2024/05/06/20240506050169_0.jpg?type=h&h=240,"South Korean hit romance drama series ""Queen of Tears,"" riding high on the strong reception from its international fanbase, is continuing its strong streaming performance, according to entertainment giant CJ ENM on Thursday. ""Queen of Tears"" claimed the second spot in Netflix's non-English-language TV list during the last week of April, rising one position from the previous week. The rankings are calculated by dividing the total hours viewed by the total runtime. It was the drama's eighth straight week in the top 10 for the category. In addition to its popularity on the streaming platform, the series also set a record on television. The final episode of ""Queen of Tears"" became the most-watched episode ever aired by tvN, the series' broadcaster, surpassing the viewership of episodes from tvN's other hit series such as ""Crash Landing on You"" (2020) and ""Guardian: The Lonely and Great God"" (2017). According to tvN, the final episode of ""Queen of Tears"" logged an average viewership rating of 28.4 percent in the Seoul metropolitan area and 24.9 percent nationwide. ""Since (the drama series') release on March 9, the accumulated viewing time for the show (on Netflix) has reached 373.2 million hours in total, bringing it close to surpassing the milestone of 400 million hours (in accumulated viewing time). Despite the drama series concluding its broadcast (on Korean television channels), there is still considerable expectation for the continued viewing (of 'Queen of Tears') on both domestic and international streaming platforms."" said an official from CJ ENM via a press release. ""Queen of Tears,"" won praise from fans for its exploration of themes such as love and loss, as well as the sincere performances delivered by its actors. ""Queen of Tears"" recorded 94 percent and 8.4 out of 10 in viewership ratings in the global online review platforms Rotten Tomatoes and IMDb, respectively, as of Thursday. Additionally, in Filmarks, the largest review site in Japan, ""Queen of Tears"" logged 4.5 out of 5 in viewership ratings. Penned by star screenwriter Park Ji-eun, whose previous works such as ""'Crash Landing on You"" and ""My Love From the Star"" have earned her global recognition, the 16-part drama series stars Kim Soo-hyun and Kim Ji-won as a married couple who lost their spark and are heading for a divorce. All 16 episodes of ""Queen of Tears"" depicting the couple's journey to rekindling their old flames are now available for streaming on Netflix and Tving.",kimsoohyun,5.0,"The article is highly relevant to Kim Soo-hyun as he is one of the two main stars of ""Queen of Tears."" The article discusses the massive success of the drama series where he plays a lead role, including its record-breaking viewership ratings and strong international performance on Netflix. The article also mentions that his performance, along with the other actors, received praise from fans. Additionally, it's noteworthy that this drama was written by Park Ji-eun, who also wrote ""My Love From the Star,"" another successful drama that Kim Soo-hyun previously starred in.",,Kim Soo-hyun's 'Queen of Tears' Shatters Netflix Records and Makes TV History,Kim Soo-hyun leads romantic drama to unprecedented success with 373.2 million streaming hours and highest-ever viewership ratings for tvN network,Acting,Drama/Series,"The article focuses on Kim Soo-hyun's leading role in the TV drama 'Queen of Tears' and its record-breaking success on both Netflix (streaming metrics) and traditional television network (tvN ratings), which directly relates to his acting career achievements in a drama series."
https://www.koreaherald.com/article/3381997,[Music in drama] Rekindle a love that slipped through your fingers,2024-05-01,https://wimg.heraldcorp.com/content/default/2024/05/01/20240501050484_0.jpg?type=h&h=240,"In retrospect, even the most steadfast commitments and promises of everlasting love can fade into the past. ""Queen of Tears,"" a love story about an estranged couple who once deeply cared for each other, set a new record as the most-watched tvN drama series of all time, with the show's final episode recording a local viewership rating of 24.9 percent. Baek Hyun-woo (Kim Soo-hyun), who grew up in an ordinary household in the countryside, fell in love with Hong Hae-in (Kim Ji-won), the daughter of the owner of top conglomerate Queens Group. Amid Hae-in's battle with untreatable brain tumors and a conspiracy targeting Queens Group, they rekindle their love for one another. Although the series contained several K-drama cliches, including a love story involving a conglomerate and terminal illness, it managed to maintain a sense of novelty with well-timed twists and humor. And, while the latter part of the series may have faced some criticism due to unrealistic plot developments, its soundtrack and high-caliber acting performances still enchanted viewers, transporting them into the story. Crush's ""Love You With All My Heart"" delicately encapsulates the emotional journey of the two protagonists as they navigate misunderstandings and feelings of resentment, ultimately rediscovering their love for each other. The warm, lyrical melody suits Crush's gentle vocals, and the lyrics imply that the two protagonists had always longed for each other, despite having drifted apart: ""Still want you all the time/ I am still waiting for you/ Filling a room in the corner of my heart with longing."" Upon hearing the news of her illness, Hae-in goes to the place she and Hyun-woo visited during their honeymoon. Hyun-woo appears before her, and the two embrace, sincerely expressing their feelings for each other. Tears stream down their faces with the fear of losing each other, accompanied by the lyrics: ""Feelings that I have forgotten and my belated sincerity/ I'm sorry for being so late.” The song ""Fallin’,"" performed by Hong Isaac, winner of the third season of JTBC's “Sing Again,” is poignant, contributing to the story with its dramatic melody. Hong's solemn voice, combined with the strings and escalating chorus, creates the perfect ambiance. ""Fallin’"" was used in a key scene in episode 14, where Hyun-woo smashes the window of a burning car with his bare hands, mistakenly thinking Hae-in had been in an accident. As Hyun-woo sheds tears and tells Hae-in that he was so afraid thinking he had lost her, Hae-in embraces him and promises to survive for him. Here, the lyrics of the soundtrack resonate strongly with the audience: ""Without you, I am nothing/ I won't save any days left without expressing my heart/ I will give them all to you."" Kim Soo-hyun immerses viewers in the story through his outstanding performance in the lead role, as well as his voice. ""Way Home"" brings the series to a beautiful end, complementing the story of the two protagonists whose love survives through all odds. Featuring the acoustic guitar and the actor’s gentle voice, it is the first song on such a soundtrack performed by Kim Soo-hyun since 2013 hit series ""My Love From the Star."" As Hyun-woo and Hae-in smile and hold hands in a vast lavender field, the song's lyrics flawlessly express, ""The only miracle in my life was the time we shared."" This series offers a multifaceted look at the soundtracks of hit Korean drama series, shedding light on how the music enriches the stories -- Ed.",kimsoohyun,5.0,"The article is highly relevant to Kim Soo-hyun as he is one of the main protagonists in ""Queen of Tears,"" playing the character Baek Hyun-woo. The article extensively discusses his performance, his character's emotional journey, and even highlights his musical contribution to the drama through the song ""Way Home"" - noting it's his first soundtrack performance since ""My Love From the Star"" in 2013.",,Kim Soo-hyun's 'Queen of Tears' Breaks All-Time tvN Ratings Record,Kim Soo-hyun delivers a powerhouse performance and lends his voice to the soundtrack in the hit drama about an estranged couple's journey back to love,Acting,Drama/Series,"The article focuses on Kim Soo-hyun's performance in the TV drama 'Queen of Tears' and its achievement of breaking tvN's ratings record, which primarily relates to his work as an actor in a television series."
