url,title,date,thumbnail,content,celebrity,relevance_score,relevance_reason,source,headline,subheading
https://en.yna.co.kr/view/AEN20221222005300315?section=search,Tving series 'Island' tells fantasy exorcism story set on Jeju Island,2022-12-22,https://img.yna.co.kr/etc/inner/EN/2022/12/22/AEN20221222005300315_02_i_P2.jpg,"...troy the world.  
   Kim Nam-gil plays an immortal monster hunter who has been protecting the world from evil demons for thousands of years. Cha Eun-woo is an exorcist who was adopted overseas soon after his birth and later dispatched to Jeju Island. Lee Da-hee appears as a rich heiress who ...",chaeunwoo,5.0,"The article directly discusses Cha Eun-woo's role as an exorcist in the TV series 'Island', describing his specific character as someone who was adopted overseas and returns to Jeju Island. This is a primary role for him in this production, making the article highly relevant to his career and work.",Yonhap News,Cha Eun-woo Takes on Demons as Mysterious Exorcist in New Thriller,Rising star Cha Eun-woo portrays an overseas-raised exorcist who returns to Jeju Island in supernatural series alongside veteran actor Kim Nam-gil
https://en.yna.co.kr/view/AEN20220426003400315?section=search,Boy group Astro to drop 3rd studio album next month,2022-04-26,https://img.yna.co.kr/etc/inner/EN/2022/04/26/AEN20220426003400315_04_i_P2.jpg,"...lbum since ""All Yours"" was released about a year ago.
   The band, which consists of members MJ, JinJin, Moonbin, Rocky, Sanha and Cha Eun-woo, debuted in 2016 with the EP ""Spring Up."" It has since released hit songs, such as ""Crazy Sexy Cool,"" ""Baby"" ...",chaeunwoo,4.0,"The article directly mentions Cha Eun-woo as one of the six members of Astro and discusses the group's upcoming album release. While not focused solely on him, it's highly relevant as it concerns his primary musical group's activities and career timeline.",Yonhap News,ASTRO's Cha Eun-woo Returns in Group's First Album Release in Over a Year,"Rising star Cha Eun-woo and his bandmates mark their comeback with new music following the success of ""All Yours"""
https://en.yna.co.kr/view/AEN20200518006700315?section=search,"4 K-pop stars, including BTS' Jungkook, test negative after visiting Itaewon last month",2020-05-18,https://img.yna.co.kr/photo/yna/YH/2020/05/16/PYH2020051603600001300_P2.jpg,"...eir agencies said Monday.
   A local internet-based daily reported earlier in the day that Jungkook, Jaehyun of NCT, Mingyu of Seventeen and Cha Eun-woo of Astro hung out at a restaurant and two different bars on April 25 in Itaewon, Seoul's most popular nightlife and multicultural ...",chaeunwoo,5.0,"The article directly names Cha Eun-woo as one of the four K-pop idols who visited Itaewon and subsequently got tested for COVID-19. It specifically mentions his group (Astro) and his presence at specific locations (a restaurant and bars) on April 25, making this article highly relevant to him.",Yonhap News,K-Pop Stars Face Scrutiny Over Secret Itaewon Night Out,"Cha Eun-woo of Astro and fellow idols spotted at multiple Seoul venues, sparking concerns amid social distancing measures"
https://en.yna.co.kr/view/AEN20191203006700315?section=search,"TV shows fall in love with football, basketball",2019-12-03,https://img.yna.co.kr/photo/cms/2019/09/28/30/PCM20190928000030005_P2.jpg,"...gers,"" slated for January, and his team members will include Cha Eun-woo, a member of boy band Astro, and actors Lee Sang-yoon and Seo Ji-...e channel subsidiary of SBS, launched a football show called ""Cha Cha Cha"" in November. It presents a football team's efforts to defeat ...",chaeunwoo,3.0,"The article mentions Cha Eun-woo as a team member in what appears to be a sports-related TV show, but his role is only briefly referenced and isn't central to the article's main focus about sports-themed television programs.",Yonhap News,K-Pop Star Cha Eun-woo Takes the Field in New Sports Challenge,Astro member Cha Eun-woo joins celebrity football team for SBS's latest sports entertainment show
https://en.yna.co.kr/view/AEN20181029007700315?section=search,YouTube to air Korean original drama themed with K-pop idols,2018-10-29,https://img.yna.co.kr/etc/inner/EN/2018/10/29/AEN20181029007700315_02_i_P2.jpg,"...),"" out in September.
   The new series, featuring rising star Cha Eun-woo from boy band ASTRO, is based on a popular web-based South Korean ...s trainee-turned-manager who has the power to foresee the future.
   Cha, who plays Yeon-woo, one member of the four-member act, said he ...",chaeunwoo,5.0,"The article is directly about Cha Eun-woo, specifically mentioning his starring role in a new YouTube Korean drama where he plays a character named Yeon-woo. As a main cast member and the only actor specifically named in the excerpt, this article is highly relevant to him and his career activities.",Yonhap News,K-Pop Star Cha Eun-woo Takes Lead Role in Supernatural Drama Series,ASTRO member Cha Eun-woo portrays Yeon-woo in new Korean series about a manager with prophetic abilities
https://en.yna.co.kr/view/AEN20180731003700315?section=search,Actress of 'Gangnam Beauty' says Cha Eun-woo is perfect for his role,2018-07-31,https://img.yna.co.kr/etc/inner/EN/2018/07/31/AEN20180731003700315_01_i_P2.jpg,"...place on July 26, 2018, in Seoul.
   The new series is about a young woman who was laughed at for being ugly while growing up seeks to find her true self.
   Im Soo-hyang and Cha Eun-woo, a member of boy band Astro, take lead roles.
   The first episode of the drama aired on July 27.
   


(END)",chaeunwoo,5.0,"The article is directly about Cha Eun-woo, specifically discussing his lead role in the drama ""Gangnam Beauty"" alongside Im Soo-hyang. It mentions him by name and references his position as both an actor and member of Astro, making it highly relevant to him.",Yonhap News,Cha Eun-woo Takes Bold Step in New Drama About Self-Discovery,Astro's Cha Eun-woo stars alongside Im Soo-hyang in heartfelt series exploring beauty standards and personal growth
