url,title,date,thumbnail,content,celebrity,relevance_score,relevance_reason,source,headline,subheading
https://www.koreaherald.com/article/1558991,"IU, BTS win at Golden Disc Awards",2018-01-12,https://wimg.heraldcorp.com/content/default/2018/01/12/20180112000396_0.jpg?type=h&h=240,"IU and BTS, arguably the two biggest music stars of 2017, won the top prizes at the Golden Disc Awards, Wednesday and Thursday. The event, held in Goyang, Gyeonggi Province, commended last year’s standout achievements in the music industry by referring to statistics from the Gaon Chart. IU won the Grand Prize for digital sales with “Through the Night.” The song, released in March, was the most streamed song of 2017. “(It is) so lucky that the song came to me,” she said, after receiving the trophy. “I am so grateful for the existence of the track.”  For the physical album sales award, boy band BTS was the grand winner for its smash hit album “Love Yourself Seung Her,” which recorded 1,493,443 album sales. “Now that we have received this great award, the records and accomplishments we achieved in 2017 suddenly feel real,” J-hope said in the acceptance speech. ()",iu,5.0,"The article specifically mentions IU (아이유) and focuses on her achievement as a singer and songwriter, winning the Grand Prize for digital sales with her song ""Through the Night."" The context aligns with her profession and expected accomplishments in the music industry.",,"IU Dominates Golden Disc Awards with Record-Breaking Hit ""Through the Night""","Singer-songwriter IU takes home the Grand Prize for digital sales, while BTS wins for physical albums."
https://www.koreaherald.com/article/1549342,Big-name  stars return to TV via new dramas in 2018,2018-01-03,https://wimg.heraldcorp.com/content/default/2018/01/03/20180103000557_0.jpg?type=h&h=240,"Surging into 2018, dramas featuring returning stars and rising rookies are coming to light up viewers’ lives. Singer and actress IU will be the leading actress of upcoming tvN drama “My Ajeossi.” Lee Sun-kyun will be IU’s “ajeossi,” meaning middle aged man in Korea. The two will play a couple with a 20-year age-gap, that learns to heal each other’s old wounds. The drama will air in the first half of 2018 and Nara of K-pop act Hello Venus will be joining the cast.  Jang Dong-gun is looking forward to returning to the small screen through “Suits,” a remake of the popular US drama series. Playing the role of a successful lawyer, played by Harvey Spector in the US series, Jang is to be joined by emerging star Park Hyung-sik. Set to air in the first half of the year on KBS2, the drama aims to continue the current courtroom drama trend. Seo Kang-joon will be a robot with artificial intelligence who falls in love with a human being, in a pre-produced sci-fi drama “Are You Human, Too?” on KBS2. As the robot is the stand-in for the son of a wealthy family who is in a coma, Seo plays the role of both the robot and the son.  Lee Byung-hun is to star alongside rising actress Kim Tae-ri in tvN’s “Mister Sunshine,” which will air in the summer. He is to play a man who travels to America in the 1870s and returns to Joseon as a US soldier. Writer Kim Eun-sook and director Lee Eung-bok, who have proven their teamwork through “Descendants of the Sun” and “The Goblin,” will pair up for the star-studded series. Red Velvet’s Joy and Woo Do-han have been confirmed as the leads of MBC’s “Great Temptation,” set to air in the first half of the year. In the drama, Woo will try to seduce Joy, who doesn’t believe in love. The storyline is based on the French novel “Dangerous Liaisons.” International star Bae Doo-na, who has established a firm position in Hollywood, will star in local drama “Kingdom,” set for release through Netflix in the latter half of the year. The global steaming service’s first original Korean drama, the eight-episode series will revolve around an epic story of Josen-era zombies. By Im Eun-byel ()",iu,5.0,"The article specifically mentions IU (아이유) and focuses on her upcoming role as the leading actress in the drama ""My Ajeossi,"" which aligns with her work as a singer, songwriter, and actress. The context is relevant to her career in entertainment, and the details confirm it is about the correct person (female, multi-talented artist).",,"**IU Shines in New Drama ""My Ajeossi"" – A Tale of Healing and Heart**","**IU takes on a poignant role opposite Lee Sun-kyun, blending her talents as a singer-songwriter and actress in this highly anticipated 2018 drama.**"
https://www.koreaherald.com/article/1546108,"After a blockbuster year, K-pop looks to keep momentum into 2018",2017-12-29,https://wimg.heraldcorp.com/content/default/2017/12/29/20171229000318_0.jpg?type=h&h=240,"From an unprecedented mega-hit debut to groundbreaking overseas successes, K-pop had one of its biggest years in 2017 in terms of diversity, substance and global outreach. And it will continue to be at the forefront of the resurgence of “hallyu,” or the global popularity of Korean pop culture, into 2018, according to industry watchers. From the start, the 2017 K-pop calendar was filled with back-to-back releases, with the first half and early summer highlights predominantly coming from female stars.  Veteran act S.E.S released two anniversary singles and FNC’s flagship act AOA put out “Angel’s Knock” in early January. Seohyun and Taeyeon of Girls’ Generation released solo works in January and February, respectively, while TWICE stormed the music charts with “Knock Knock” and “Signal” in February and May. GFriend released two EPs and a repackaged record in the span of just six months, while smaller yet rising acts, such as Lovelyz and Gugudan, also deepened their discographies with new albums in the first quarter. Women also stood out in the singer-songwriter category, with artistic underdogs Suran and Heize both hitting big with “Wine” and “/// (You, Clouds, Rain),” respectively. IU also released her fourth full-length album, “Palette,” in April to critical and commercial success, while ex-FIN.K.L leader Lee Hyo-ri returned to the spotlight in July with “Black,” transforming herself from a sexy dance music icon into a genuine musician-artist. Ex-Wonder Girls chanteuse Sunmi successfully rebooted her music career with her captivating dance number “Gashina.” Big name boy bands lined up in the second half of the year to release their most ambitious projects to date. EXO of S.M. Entertainment released its fourth full-length album, “The War,” in mid-July and the much-hyped project group Wanna One, formed by survivors of idol audition show “Produce 101,” made one of the biggest K-pop debuts in history in August. K-pop titan BTS also dropped “Love Yourself: Her,” its biggest album so far, in mid September.  The alternative music realm also saw a slew of critical darlings released. In June, G-Dragon put out “Kwon Ji Yong,” his fourth solo album, full of semi-autobiographical songs that reflect the BIGBANG member’s insecurities and growing pains. Hip hop trio Epik High also released its ninth studio album, “We’ve Done Something Wonderful,” drawing on themes of regret, fear and alienation, in October. The year also saw a number of rising artists grow and mature. With successive hits “Red Flavor” and “Peek-A-Boo,” Red Velvet cemented its position as a S.M. Entertainment’s marquee girl group, as Girls’ Generation, the label’s previous female stronghold act, entered its twilight phase after key members bolted. Taemin of SHINee also successfully morphed his career into that of a serious solo artist with “Move.” “Taemin has shown how an artist can establish his or her image through stage and performance and maintain it in a consistent fashion. His potential has exploded sufficiently in his latest album,” said Kim Youngdae, a South Korean music critic based in the U.S. city of Seattle. Looking back, 2017 was also a critical year for K-pop rejuvenating and further advancing its global outreach -- with BTS achieving a major breakthrough in the United States and TWICE landing a record-smashing Japanese debut. BTS’ American breakthrough was stoked in earnest in May, when the band won the Top Social Artist award at the 2017 Billboard Music Awards in May. The septet broke new ground with their “Love Yourself: Her” album, which debuted at No. 7 on the Billboard 200 chart in September, while “DNA” and “Mic Drop,” the latter as a remix single by DJ Steve Aoki, both entered the crucial top 40 of Billboard’s main Hot 100 chart. Having remained under the radar to the U.S. public and media, BTS’ American fan community this year went full throttle in throwing its weight behind the K-pop sensation, organizing a national radio song request campaign to boost the group’s U.S. profile from niche to mainstream. The group made major television outings, including a live TV performance at the American Music Awards in November and appearing on “The Ellen DeGeneres Show” and “Jimmy Kimmel Live!” TWICE made its first overseas gamble this year by debuting in Japan, a neighboring country that has a complicated and troubling history with South Korea. The payoff was huge, with album “#TWICE” being certified Platinum by the Recording Industry Association of Japan, an honor bestowed on records with sales of over 250,000 copies. The group, which is represented by JYP Entertainment and includes Japanese and Taiwanese members, followed up its success with a fall Japanese single, titled “One More Time.” The ladies didn’t slouch at home either, as they dropped their first full-length studio album, “Twicetagram,” in late October and their winter album, “Merry & Happy,” earlier this month. The K-pop scene this year also had its share of controversies and tragedies, with undoubtedly the biggest being the tragic death of SHINee lead singer Kim Jong-hyun, who apparently ended his own life on Dec. 18 due to depression. The incident sent shock waves throughout the broader K-pop community around the world. In July, BIGBANG rapper T.O.P was convicted for smoking marijuana multiple times at his apartment in October of last year, while SHINee singer Onew was investigated by police after being accused of sexually harassing a woman at a night club in August. Critics and industry observers expect the K-pop industry to expand further in scale overseas. “BTS this year has shown a level of growth that was unforeseeable. I think K-pop in general will continue its ascent next year, as well. BTS will leave an even bigger footprint in 2018 in my opinion,” Im Jin-mo, a Seoul-based music critic, said. Kim Youngdae predicted that K-pop will see its overseas fans base diversify further in 2018. “As witnessed in KCON in America this year, K-pop in the U.S. is slowly expanding its fan base into the African American and Latin American communities. I think Korean music in general will continue to add new layers of fans in addition to previous ones fond of Asian culture,” noted Kim. The industry is also cautiously optimistic of a market rebound in China, where sales of Korean cultural products, including TV shows and music concerts, were impeded for more than a year over Seoul’s decision to host a U.S. anti missile system, commonly referred to as THAAD. South Korea and China have announced that they will cooperate to normalize their ties in many areas that had been strained for months over the THAAD deployment. Idol audition shows are forecast to be bigger than ever but some are wary that the genre’s novelty factor has started wearing off. TV showrunners will try to keep things fresh by throwing in more variety TV show elements to engage the audience. The gender of contestants will also be a key factor in the success of shows. “One of the reasons Wanna One struck big is that its members were males, as opposed last year’s ‘Produce 101’ team I.O.I being formed by female singers. In reality, the majority of idol music fans consist of females. With that in mind, I don’t think anyone can guarantee whether (‘Produce 101’) will continue its explosive run next year,” said Im. (Yonhap)",iu,4.0,"The article specifically mentions IU (아이유) and highlights her work as a singer-songwriter with the release of her fourth full-length album ""Palette,"" which achieved critical and commercial success. While it does not discuss her acting career, the context aligns with her musical achievements, which are central to her identity as a female artist in K-pop.",,IU Shines in K-Pop’s Record-Breaking Year of Global Domination,"As a singer-songwriter and actress, IU captivated fans with her critically acclaimed album ""Palette,"" solidifying her place in K-pop’s historic 2017."
https://www.koreaherald.com/article/1540230,IU named singer of the year in survey,2017-12-21,https://wimg.heraldcorp.com/content/default/2017/12/21/20171221000679_0.jpg?type=h&h=240,"IU has been chosen as the top singer of the year in an annual poll. Gallup Korea canvassed 4,200 people aged 13 to 59 across the country from July 6-26, Sept. 1-29 and Nov. 8-28, and the singer took the top spot, racking up 15.2 percent of total votes. Having debuted in 2008, IU released many chart-sweeping songs, including “Good Day,” “You & I” and “The Red Shoes.” In 2014, the singer was named best singer of the year in the survey as her cover album “A Flower Bookmark” gained popularity among all age groups. Girl group Twice, which had a prolific year with its hits “Knock Knock,” “Signal,” “Likey” and “Heart Shaker,” came in at second with 9.1 percent. Trot singer Jang Yun-jeong came in third with 8.9 percent while global K-pop sensation BTS came in at No. 4 with 8.5 percent. Following BTS on the list were Yoon Jong-shin, Wanna One, EXO, Big Bang, Im Chang-jung and Lee Sun-hee. By Kim So-yeon ()",iu,5.0,"The article specifically mentions IU (아이유) and focuses on her achievements as a singer, including her recognition as ""singer of the year"" and her popular songs. It aligns with her identity as a female singer-songwriter and matches the expected context for her career.",,IU Crowned Top Singer of the Year in Nationwide Poll,"IU dominates Gallup Korea's annual survey with 15.2% of votes, solidifying her reign as a beloved singer-songwriter and actress."
https://www.koreaherald.com/article/1530137,‘Hyori’s Bed & Breakfast’ in search of new guest helper,2017-12-13,https://wimg.heraldcorp.com/content/default/2017/12/13/20171213000931_0.jpg?type=h&h=240,"Director Jeong Hyo-min of JTBC reality show “Hyori’s Bed & Breakfast” announced Tuesday the show is on the lookout for the next guest and helper at Lee’s home on Jeju Island for the second season. The production staff said they have “a few people in mind to fill IU’s shoes.” Singer IU, who had been the guest and helper at Lee’s Jeju home throughout the first season of the show, received a lot of love from fans for her dedication as Lee‘s helper. The singer will not be joining the second season of the show, slated to start shooting in January, due to a conflict with another shooting schedule. Jeong expressed her wishes to conceal the identity of the new guest and hopes to capture the couple of Lee Hyo-ri and Lee Sang-soon’s happiness on camera upon seeing the new helper arrive at the couple‘s home. The second season of “Hyori’s Bed & Breakfast” has been taking reservations for a homestay via the show‘s official homepage, with the number of applicants exceeding 160,000 as of Wednesday. Applications for the upcoming season are more than five times greater that of the first season, with some 30,000 people having applied last year. Jeong further thanked viewers for the huge support and love for the show. “Hyori’s Bed & Breakfast” will start meeting with applicants for interviews on Thursday. Applications for the homestay with the Lees will be open-ended throughout the show. Similar to the first season, “Hyori’s Bed & Breakfast” is to take on the same concept of “healing” on Jeju Island with the couple. The contrast will be that the guests and helper will be different, with the setting as wintery Jeju Island. The show is set to air during the first half of next year. ()",iu,4.0,"The article specifically mentions IU (아이유) and discusses her role as a guest helper in the first season of ""Hyori’s Bed & Breakfast,"" highlighting her popularity in the show. While the focus is not directly on her work as a singer, songwriter, or actress, it does relate to her public persona and entertainment career. The context aligns with her occupation as a multi-talented entertainer, though the article's primary focus is on the show's new season rather than her artistic work.",,"**IU’s Absence Leaves Big Shoes to Fill in ""Hyori’s Bed & Breakfast"" Season 2**","As IU bows out due to scheduling conflicts, fans wonder who will step into her beloved role as the show’s helper."
https://www.koreaherald.com/article/1482000,Epik High’s done something wonderful with new album,2017-10-24,https://wimg.heraldcorp.com/content/default/2017/10/24/20171024000633_0.jpg?type=h&h=240,"Hip-hop trio Epik High is sweeping music charts at home and overseas with its long-awaited ninth full-length album “We’ve Done Something Wonderful.” Since their release on Monday evening, the album’s two lead tracks “Home is Far Away” and “Love Story,” each featuring singer Oh Hyuk and IU, quickly cruised to the top of seven local music charts including Melon and Naver Music. Other tracks from the album -- which feature star-studded artists such as Crush, Suhyun of AKMU, Kim Jong-wan of Nell, Song Min-ho of Winner, Simon Dominic, The Quiett and Lee Hi -- also secured high spots on music charts. The album went strong on foreign music charts, topping the iTunes Top Albums Chart in 10 countries including Columbia, Peru, Vietnam and Hong Kong. Following the release of its new album, Epik High will hold solo concerts, which will take place on Nov. 3 and 4 at Blue Square Samsung Card Hall in Hannam-dong, Seoul. By Kim So-yeon ()",iu,4.0,"The article specifically mentions IU as a featured artist in Epik High's album, which aligns with her work as a singer. However, the main focus of the article is on Epik High's album and achievements, not IU's career or contributions as a songwriter or actress. The context is relevant but not centered on her.",,"IU Shines in Epik High’s Chart-Topping Album ""We’ve Done Something Wonderful""","The multi-talented singer-songwriter and actress features in two hit tracks, helping the album dominate global charts."
https://www.koreaherald.com/article/1462090,[Album review] IU’s classics cover album lacks raw emotion,2017-09-28,https://wimg.heraldcorp.com/content/default/2017/09/28/20170928001078_0.jpg?type=h&h=240,"IU “A Flower Bookmark #2” Loen Entertainment Attempting to recreate the magic of classics, this 24-year-old songstress seems to be bent on proving that she isn‘t just an idolized K-pop singer. With her latest offering “A Flower Bookmark #2,” IU aims to present herself as a thoughtful musician whose heart belongs to the bygone decades. Maybe it’s her signature breathy and light vocals, but the cover album doesn’t quite bear the weight and complicated emotions of the originals. IU flaunts her crystal clear voice in “Autumn Morning,” a 1991 folk tune by veteran singer Yang Hee-eun and guitarist Lee Byung-woo. But the song’s poetic lyrics are overshadowed by the singer’s overly sweet and soft voice. “Secret Garden,” a cover of Lee Sang-eun’s beloved song from 2003, suffers from the same problem. Lee‘s warm and mature voice delivers a message of encouragement, but the song’s power is diminished when delivered in IU‘s ear-tickling voice. “Last Night Story,” a remake of the 1988 hit by trio Sobangcha, is perhaps the most notable track from the EP. Instead of being a sugary fairy, IU experiments with rather deadpan and pouty vocals in the upbeat retro song, morphing into a late-night party girl who bemoans the previous night. One is glad to hear a song that fits the singer, finally making IU sound and look more her age. Other covers such as “Sleepless Rainy Night,” originally by Park Kwang-hyun in 1990 and made famous by Kim Gun-mo in 1992, and “Everyday With You” by ’80s icons Deulgukhwa, don’t sound that different from covers by other artists. And IU’s vocals, although flawless, are still too shallow for “Rapids,” a mournful poetic ballad by Jeong Mi-jo from 1972. The six cover songs that revisit the ‘60s to the early 2000s are well made and diverse, but IU may have been too ambitious in her bid to pay homage to the old classics she admires. By Hong Dam-young ()",iu,5.0,"The article specifically mentions IU (아이유) and focuses on her work as a singer and musician, critiquing her cover album ""A Flower Bookmark #2."" It aligns with her identity as a female singer-songwriter and discusses her vocal style and artistic choices, which are relevant to her profession. The context is appropriate for a review of her musical work.",,"IU Reimagines the Past with ""A Flower Bookmark #2"" – But Does She Capture Its Soul?","The multitalented singer-songwriter and actress pays homage to classics, yet her delicate vocals sometimes overshadow their emotional depth."
