url,title,date,thumbnail,content,celebrity,relevance_score,relevance_reason,source,headline,subheading
https://www.koreaherald.com/article/2876775,Cannes-winning actor Song Kang-ho talks about historic award receiving moments,2022-05-31,https://wimg.heraldcorp.com/content/default/2022/05/31/20220531000781_0.jpg?type=h&h=240,"Song Kang-ho recalled what it was like to receive the country’s first best actor award at the 75th Cannes Film Festival during the first press conference for the film held after he returned from France on Tuesday. “Very few get to receive awards at Cannes. Only seven out of 21 movies (in competition) get awards. Before midnight those seven films get a notice that they will receive awards. So I was really nervous before midnight,” Song said during the press conference held at CGV Yongsan. “It is hard to recall the exact moment when my name was announced. I think I panicked and had a bizarre feeling and also was very happy.” Song added that the first text messages he received after getting the award were from director Bong Joon-ho in London and director Kim Ji-hoon in Korea. “They were watching the awards ceremony on YouTube. I received so many congratulatory messages and so much praise. I want to continue to enjoy them little by little,” Song joked. Director Hirokazu Kore-eda also shared what it was like to watch Song receive the top actor prize. “I am a little cynical, so when people praise my work I think about which part was good and can never enjoy their praise. But when my actors receive praise, I can truly enjoy it and be happy,” the director said. “Japanese reporters also told me that I look happier than usual. I really could enjoy the after-party of the awards ceremony to the extent that I could not believe it.” The Japanese director added to the praise for Song’s performance. “I think Song won the award not because I did something right; it was due to accumulated work that he has done. I could not believe that he had not received any awards previously,” he said. “If he had received the award earlier for appearing in director Bong Joon-ho’s work or director Lee Chang-dong’s work, nobody would think that he does not deserve it. I feel sorry that he is receiving it (belatedly) with my project, and I am so happy. It is the best award that my movie ‘Broker’ can receive.” Kore-eda’s “Broker” features a bevy of Korean stars, including Song, Bae Doo-na, Gang Dong-won and IU, and centers on relationships formed through “baby boxes” installed at churches or institutions where desperate parents can leave their newborns anonymously. The Japanese director’s film hits local theaters on June 8.",iu,3.0,"The article mentions IU as part of the cast of the film ""Broker,"" which aligns with her work as an actress. However, the primary focus is on Song Kang-ho's Cannes award and his reflections, not IU's contributions or her broader career as a singer-songwriter-actress. The context is relevant but not central to her.",,"IU Shines Alongside Song Kang-ho in Acclaimed Film ""Broker""",The multi-talented singer-songwriter and actress joins an all-star cast in Hirokazu Kore-eda’s Cannes-winning drama.
https://www.koreaherald.com/article/2877996,"CJ ENM anticipated to hit jackpot with ‘Decision to Leave,’ ‘Broker’: experts",2022-05-30,https://wimg.heraldcorp.com/content/default/2022/05/30/20220530000604_0.jpg?type=h&h=240,"CJ ENM is likely to hit the box office jackpot as an investment distributor of two films -- “Decision to Leave” and “Broker” -- which won major titles at the 75th Cannes Film Festival, film critics said. Park Chan-wook won best director for “Decision to Leave” and Song Kang-ho won best actor for “Broker” at Cannes on Saturday. Some local film critics predicted that CJ ENM could sell as many tickets as it did pre-pandemic in 2019 with the two films. “Since I have not seen the film yet it is hard to predict, but ‘Broker’ has Song Kang-ho and many strong points as a commercial film so I expect to be successful (at the box office),” film critic Jung Ji-wook said. Culture critic Ha Jae-keun was a bit more cautious but believed the films would have a good start. “The recent trend has been that just because films won some awards at a big film festival, does not automatically mean the films can attract moviegoers. I think success will depend on actual moviegoers’ reviews,” Ha said. “But since the two films got a lot of attention from the media, it will help attract audiences in the beginning.” CJ ENM will release “Broker“ on June 8 and release “Decision to Leave” three weeks later, on June 29. So far, three films in which CJ ENM has invested and holds distributions rights to have won at the Cannes Film Festival, including Bong Joon-ho’s “Parasite,” which won the Palme d’Or at Cannes in 2019. “Parasite,” which was released after winning the Palme d’Or, sold 10.31 million tickets. Sales at CJ ENM’s film business increased by 63.8 percent to 349.3 billion won ($281.65 million) and its operating profit reached 43.6 billion won.  Meanwhile, the two films -- “Decision to Leave” and “Broker” -- have been performing well in the global film market. “Decision to Leave” has been sold to 192 countries, which is close to the record held by “Parasite,” which was sold to 205 countries. “Broker” has been sold to 171 countries. Park’s new movie centers on a polite and honest police officer named Hye-jun (Park Hye-il). Hye-jun looks into a suspicious death that occurred on a mountain and comes to suspect the dead man’s wife, the mysterious Seo-rae (Tang Wei). At the same time, Hye-jun becomes attracted to her. “Broker” features a cast of famous Korean actors, including Song, Bae Doo-na, Gang Dong-won and IU, and centers around the relationships formed through a “baby box,” a box installed at churches or institutions where desperate parents can leave their newborns anonymously.",iu,3.0,"The article mentions IU as part of the cast of ""Broker,"" which aligns with her occupation as an actress. However, the focus of the article is primarily on CJ ENM's box office prospects and the films' achievements at Cannes, not specifically on IU's work as a singer, songwriter, or actress. The context is relevant but not central to her primary career activities.",,"IU Shines in Award-Winning Film ""Broker"" as CJ ENM Eyes Box Office Success","The multi-talented singer-songwriter and actress joins a star-studded cast in the Cannes-winning drama, part of CJ ENM's global cinematic triumph."
https://www.koreaherald.com/article/2877701,"Park Chan-wook wins best director, Song Kang-ho, best actor at Cannes",2022-05-29,https://wimg.heraldcorp.com/content/default/2022/05/29/20220529000098_0.jpg?type=h&h=240,"One of the world’s most prestigious film festivals has once again acknowledged the power of South Korean cinema. South Korea took home two major titles -- Park Chan-wook won best director for “Decision to Leave” and Song Kang-ho won best actor for “Broker” – at the 75th Cannes Film Festival that ended Saturday. Park’s thriller-romance film, “Decision to Leave,” about a detective who comes across a widow who is a prime suspect in his murder investigation, stars Korean actor Park Hae-il and Chinese actor Tang Wei. In accepting his award, Park expressed gratitude to fans for going to theaters and looked forward to a bright future for cinema. “With the dreadful pandemic, there were times when we struggled due to the theaters closing down, but at the same time, we all realized how precious the existence of theaters had been to us. I am confident that we will keep safeguarding the cinemas in difficult times, like we have been through the pandemic,” Park said in Korean. This marks Park’s third win at Cannes. He won the Grand Prix in 2003 for the thriller “Oldboy” and the Jury Prize in 2009 for the horror film “Thirst.” Although “The Handmaiden” failed to win at Cannes in 2016, it went on to win the best film not in the English language at the British Academy Film Awards in 2018. No stranger to Cannes -- this was his seventh visit -- Song won his first-ever Cannes prize for playing an illegal baby broker in Japanese director Hirokazu Kore-eda’s heartwarming tale about a Korean family seeking home for an abandoned baby found in a “baby box.” The film is Kore-eda’s first all-Korean cast, all Korean-language film and also stars Gang Dong-won, Lee Ji-eun, also known as singer IU, and Bae Doo-na who starred in Kore-eda’s 2009 film, “Air Doll.” Meeting with reporters later, Park explained how his film differs from others in similar genres and with similar plots. “The first part ends and the second part unfolds in a new direction,” Park said. The woman who was pictured as a mysterious femme-fatale is no longer a subject of male gaze, but telling her own story, moves to the center of the story, Park explained. Song paid tribute to Kore-eda for his understanding of Korean culture, which made Song and other Korean actors comfortable throughout the shoot. “I have seen almost all of Kore-eda’s films so far. Not just myself, but many Korean fans love his films for the distinctive aesthetics of Japanese movies,” Song told reporters. The nine-member jury led by French actor Vincent Lindon gave the Palme d’Or to Swedish director Ruben Ostlund’s class warfare comedy “Triangle of Sadness.” This is the director’s second win of the top honor prize after “The Square” in 2017. Actor Zar Amir Ebrahimi was named best actress for her role as a journalist in Ali Abbasi’s “Holy Spider.” The jury prize went to “Le Otto Montagne” directed by Charlotte Vandermeersch and Felix van Groeningen, and “Eo” by Jerzy Skolimowski. By Kim Hae-yeon ()",iu,3.0,"The article mentions IU (Lee Ji-eun) as part of the cast of the film ""Broker,"" which aligns with her work as an actress. However, the primary focus of the article is on Park Chan-wook and Song Kang-ho's achievements at Cannes, not IU's contributions as a singer, songwriter, or actress. The context is relevant but not central to her career.",,IU Shines at Cannes as South Korean Cinema Takes Center Stage,"Singer-songwriter and actress IU stars in the acclaimed film ""Broker,"" contributing to South Korea's historic wins at the 75th Cannes Film Festival."
https://www.koreaherald.com/article/2877037,"Kore-eda says if 'Broker' is not fun, this would be his responsibility",2022-05-27,https://wimg.heraldcorp.com/content/default/2022/05/27/20220527000272_0.jpg?type=h&h=240,"CANNES, France -- Japanese auteur Hirokazu Kore-eda has said that he will take full responsibility for any criticism for his Cannes-competing drama ""Broker"" made with Korean creative minds. ""Korea's star actors and renowned crew members participated in this project,"" the Japanese director told Korean reporters on Wednesday (local time) on the sidelines of the ongoing 75th Cannes Film Festival in Cannes. ""If the film isn't fun, it's all my fault."" ""Broker,"" written and directed by Kore-eda, depicts the relationships of characters formed through a baby box, where people anonymously drop off newborns that they can't raise. It is the Japanese director's first Korean-language project and is produced and distributed by Korean firms, including CJ ENM, a leading entertainment firm in the country. ""Parasite"" star Song Kang-ho plays the lead role in the drama, along with star actors Kang Dong-won and Bae Doo-na and singer-and-actress Lee Ji-eun, also known as IU. Crew members behind ""Parasite,"" including director of photography Hong Kyung-pyo and composer Jung Jae-il, also teamed up with Kore-eda, who visited the Cannes festival for the eighth time with ""Broker"" following ""Shoplifters,"" the winner of the Palme d'Or in 2018. ""I can say that the movie has an excellent ensemble cast of five lead actors and two children actors. Their performance changes further in an interesting way,"" he said. ""I hope you enjoy their on-screen chemistry."" He noted that ""Broker"" is different from typical and familiar stories about family bound by blood or necessity featured in his critically acclaimed works, like ""Still Walking"" (2008), ""Like Father, Like Son"" (2013) and ""Shoplifters."" ""While doing some research and writing the script, I thought this movie is about life,"" he said. ""It tells a story of a life who gets involved with well- and ill-intentioned people and goes on a trip to Seoul from Busan."" Meanwhile, ""Broker"" drew mixed media reviews after the film's official screening as one of the in-competition pieces at Cannes on Thursday. British daily Guardian gave two stars out of five, saying that Kore-eda's new film is ""fundamentally silly, with tiringly shallow characterization."" It pointed out that the film depicts the broker (Song) or kidnapper, who steals a newborn for himself and offers it for sale on the adoption black market, as a ""lovable rogue."" The Telegraph also gave two stars in a review, saying ""this may be the Cannes competition's biggest disappointment."" On the other hand, US media Deadline said ""Broker"" has some ""slackness"" in the storytelling, but its warm and humorous tone works well throughout the story. ""Esteemed Japanese director Hirokazu Kore-eda walks a fine line between keen social observation and overt sentimental emotionalism in Cannes competition title 'Broker,'"" it said. Variety, a US entertainment magazine, praised the film for its warm and nonjudgmental look at baby boxes and their back stories, adding ""audiences unexpectedly come to empathize with practically everyone involved in the buying and selling of a little bundle of joy."" (Yonhap)",iu,4.0,"The article mentions IU (Lee Ji-eun) as part of the cast of ""Broker,"" which aligns with her work as an actress. However, the focus of the article is primarily on the film and director Hirokazu Kore-eda, not specifically on IU's contributions or her broader career as a singer-songwriter. The context is relevant but not deeply centered on her.",,"IU Shines in Kore-eda's Cannes Drama ""Broker"" Amid Mixed Reviews",Singer-songwriter and actress IU joins an all-star cast in Hirokazu Kore-eda's heartfelt exploration of unconventional family ties.
https://www.koreaherald.com/article/2866181,"[Feature] Major movie projects link foreign directors, Korean actors to draw global audiences",2022-05-17,https://wimg.heraldcorp.com/content/default/2022/05/16/20220516000682_0.jpg?type=h&h=240,"Surging global demand for K-content drive international productions  Famous Korean stars Song Kang-ho, Kang Dong-won, IU and Lee Joo-young entered the theater to take part in a press event held at Yongsan CGV on May 10. Just like every other press event with Korean reporters, the stars introduced their roles in the new film, shared their experiences from the set and posed for photos. However, there was one difference. Director Hirokazu Koreeda joined the event via video conference from Japan. There was also an interpreter for the director. The situation was similar to the press conference for “Vanishing” held in March. The film’s director Denis Dercourt could not be present at the event, and took part via video conference with an interpreter. One of the commonalities between the two films is that they are both directed by foreign directors and shot entirely in Korea with Korean staff and mostly Korean actors. Japanese director Koreeda’s highly anticipated film, which is competing at the Cannes Film Festival running through May 28, centers around the relationships formed through a “baby box,” a unique drop box installed at churches or institutions in Korea for desperate parents who wish to anonymously leave their babies. “Vanishing” depicts the story of Alice (played by Olga Kurylenko), a successful forensic scientist and a Korean police officer (Yoo Yeon-seok). While the two protagonists investigate a murder case in Korea together, they fall in love. Local culture critics suggest that more films like these are being made due to the surging global demand for Korean content. The global success of films like “Minari” (2020) and “Parasite” (2019) and actors like Youn Yuh-jung and Jung Ho-yeon highlight this trend.  “These global projects are being made because K-content — ones with a Korean-style storyline or Korean movie stars — are demonstrating potential in the global market,” said film critic Jung Ji-wook. He added that in the case of Koreeda’s film, producers worked with Koreeda not because he is Japanese, but because he is a world-renowned director who can work on projects on a global scale. Culture critic Kim Hern-sik shared a similar opinion. “I would say there is a shift from a localization strategy to globalization. For example, previously global projects were organized to enter a certain market -- to Vietnam, Japan and so on,” Kim said. “As the scale of Korean content grows, I think we have started targeting global audiences rather than audiences of a specific country. I think global projects have evolved in a way.” The critics also went on to explain how recent global projects are different from those from the past. “Earlier global projects did not work well. It was usually like this. If it was a project between Korea and Japan, it had a Korean man and a Japanese woman as protagonists. It focused on attracting audiences from both Korea and Japan, but ended up being neither a Japanese- nor Korean-style movie -- and failed,” Jung said. “And then there were Korean directors working overseas. They were not there as ‘Korean directors’ though. They were there because they are globally renowned directors like Park Chan-wook and Bong Joon-ho.” Both Jung and Kim view the recent changes as progress. “I see the changes as positive. Before, we only thought about global directors like Park Chan-wook working with European actors. Now it is different,” Kim said. Jung also predicts that there will be more cases of foreign directors working with Korean actors and staff.  “I am not saying that there will be an instant change, because these movies aim big -- they aim for the world market,” Jung said. “For instance, if we are only talking about the Korean market, when a certain type of movie is successful, then similar films flood the market. We’ve seen this happen,” she said. This is not the case with global projects, because they usually take more time to start, according to Jung. However, she said such projects will continue to be made. Meanwhile, culture critic Kim pointed out that now is a time for to think about what defines Korean movies. “Some people say ‘Pachinko’ has nothing to do with Korea and is not relevant to us. But it was created by Korean Americans who were influenced by Korean content growing up,” Kim said. “I don’t think the content has to be made in Korea to become K-content. So now we need to start having a conversation about what defines K-content, as we expect to see more and more collaboration projects.”",iu,4.0,"The article specifically mentions IU as one of the Korean stars involved in a press event for a film project directed by a foreign director, which aligns with her work as an actress. However, the article's broader focus is on global collaborations in Korean cinema, not specifically on IU's contributions as a singer or songwriter. The context matches her occupation as an actress but does not delve into her music career.",,IU Shines as K-Content Goes Global in New International Film Collaborations,"Singer-songwriter and actress IU joins Korean stars in groundbreaking projects, highlighting the rising demand for Korean talent worldwide."
https://www.koreaherald.com/article/2863121,'He’s like the sun’: Director Koreeda praises veteran actor Song Kang-ho,2022-05-11,https://wimg.heraldcorp.com/content/default/2022/05/10/20220510000717_0.jpg?type=h&h=240,"Even for veteran director Hirokazu Koreeda, who won the Palme d’Or at the Cannes Film Festival in 2018 for “Shoplifters,” directing a movie in a foreign country was a challenge. During a press conference at CGV Yongsan in Seoul on Tuesday, the Japanese director said he got a lot of help from “Parasite” star Song Kang-ho while filming his movie, “Broker.” “Before shooting the film, I had a meeting with director Bong Joon-ho. We talked over a meal and he gave me suggestions on shooting a film in a foreign country. He said I must be nervous directing a movie in a foreign country, but once everything begins, all I have to do is believe in Song Kang-ho,” the director said. “He told me that Song Kang-ho is like a sun that will shine light everywhere on the filming site. After I worked with him, I realized that he (Bong) was right. Because of Song, I was able to finish the project without any problem.” Koreeda’s highly anticipated film centers around the relationships formed through a “baby box,” a drop box installed at churches or institutions for desperate parents to leave babies anonymously. It aims to prevent those parents from abandoning or even killing their newborns. Song plays Sang-hyun, a mysterious “broker” who finds new parents for the abandoned babies and makes special deals with them. Korean heartthrob Gang Dong-won plays Sang-hyun’s business partner. Bae Doo-na plays a police officer who is on Sang-hyun’s trail. Singer and actor IU plays a mother who travels with Sang-hyun to find parents for her baby. During the press conference, Song recalled his first meeting with the director in Busan. “It was six or seven years ago, we met for the first time at the Busan International Film Festival. The title was not ‘Broker’ at the time,” Song said. “I decided to take the role because I am his fan and I love his works. He is an artist that I respect, so I was honored.” The director also briefly talked about the movie being selected to premiere at the upcoming Cannes Film Festival. “No matter how many times I’ve been there, Cannes always makes me nervous. I am also excited to be there. I think it is the best place for the world premiere of ‘Broker’,” the director said. The 75th Cannes Film Festival will run from May 17-28. Meanwhile, at the beginning of the press event, Song stood up and talked about the late Korean actor Kang Soo-youn, who died from cerebral hemorrhage on Saturday at the age of 55. “We actors are grieving over the tragic news from a few days ago,” Song said. “On behalf of the whole ‘Broker’ team, I offer condolences to Kang Soo-youn.” “Broker” will hit local theaters on June 8.",iu,3.0,"The article mentions IU (아이유) as part of the cast of the film ""Broker,"" aligning with her work as an actress. However, the primary focus of the article is on director Koreeda and actor Song Kang-ho, with only a passing reference to IU's role. It does not discuss her music career or songwriting, limiting its relevance to her overall profile.",,"IU Shines in Koreeda's ""Broker"" as a Mother on a Heartfelt Journey","Singer-songwriter and actress IU joins an all-star cast in this Cannes-selected drama about love, loss, and second chances."
