url,title,date,thumbnail,content,celebrity,relevance_score,relevance_reason,source,headline,subheading
https://www.koreaherald.com/article/3650447,아이유 팬카페에 셀카 공개,2014-01-20,https://wimg.heraldcorp.com/content/default/2014/01/20/20140120001112_0.jpg?type=h&h=240,"아이유의 팬카페 셀카가 화제다.   아이유는 19일 자신의 팬카페인 ‘유애나’에 “안녕”이라는 짧은 글과 함께 셀카사진을 공개했다. 공개된 사진 속 아이유는 짧은 헤어스타일에 흰색 블라우스를 입고 꽃받침 손동작을 취하며 물오른 외모를 한껏 자랑하고 있다. 아이유 팬카페 셀카를 접한 누리꾼들은 “아이유 팬카페 셀카, 이젠 완벽한 숙녀가 됐네” “아이유 팬카페 셀카, 정말 예쁘다” “아이유 팬카페 셀카, 꿀피부에 사랑스러움까지…”등의 반응을 보였다. (khnews@heraldcorp.com)   [Photo News] Singer IU flaunts beauty in selfie  Singer IU unveiled a selfie Sunday on her official website for fans, with a short comment “Hello.” In the picture, she looks mature in a white shirt and short hair. ()",iu,4.0,"The article specifically mentions IU (아이유) and focuses on her personal appearance via a selfie shared on her fan cafe, which is relevant to her public image as a singer and actress. However, it does not directly discuss her work as a songwriter, singer, or actress, which slightly limits its relevance. The context aligns with expectations for a celebrity update but lacks professional depth.",,"IU Stuns Fans with Flawless Selfie, Showcasing Her Timeless Beauty","The multi-talented singer, songwriter, and actress shares a radiant snapshot on her fan cafe, sparking admiration from netizens."
https://www.koreaherald.com/article/28567,"""애프터스쿨 나나가 2번째로 가장 아름다운 얼굴"" 평가한 인디펜던트 크리틱스는 어떤 매체?",2013-12-25,https://wimg.heraldcorp.com/content/default/2013/12/25/20131225000107_0.jpg?type=h&h=240,"최근 언론을 통해 소개된 “가장 아름다운 얼굴 100인 (The 100 Most Beautiful Faces 2013)”을 엮은 영화 비평 사이트 인디펜던트 크리틱스에 대한 궁금증이 일고 있다. 인디펜던트 크리틱스(IndependentCritics.com)는 영국 출생의 영화 비평가 TC 캔들러가 다른 두 명의 비평가와 힘을 합쳐 만든 웹사이트이다. 1990년대 후반, 상업적이지 않은 영화 비평으로 인기를 끌던 캔들러는 영화 리뷰, 유명인사 인터뷰와 컬럼 등으로 이뤄진 이 사이트를 만들었는데, 이는 2000년대 중반부터 큰 인기를 끌었다고 한다. 이 웹사이트는 지난 1999년부터 ‘올해의 가장 아름다운 100인’ 리스트를 발표해왔는데, 캔들러가 작년에 밝힌 선정기준에 따르면 “다양한 문화, 생활방식, 직업과 다양한 인지도를 고려한 국제적인 리스트”이라고 한다. 또한 “인기 콘테스트(popularity contest)”가 아니라면서 인지도가 절대적인 선정기준이 아님을 강조했다. 실제로 이 목록에서 2위를 오른 애프터스쿨의 나나는 영미권에서는 인지도가 낮은 축에 속하며 인디펜던스 크리틱스는 “2012년 리스트를 발표하기 며칠 전에야 팬들의 수많은 추천을 통해 알게 되었다”고 설명했다. 이 매체는 또한 그녀가 2014년에 1위로 선정될 강력한 우승후보라며 “누가 그녀를 막을 수 있을까?”라고 의문을 던졌다. 이 매체가 최근 발표한 리스트에서는 프랑스의 배우 마리옹 꼬띠아르가 1위를 차지했으며, 나나를 포함해 태연, 수지, 송혜교 등 총 14명의 한국 연예인들이 순위에 올랐다.   <관련 영문 기사>  [Photo News] K-pop singers included on ‘most beautiful faces’ list for 2013  A host of K-pop singers have been included on “The 100 Most Beautiful Faces 2013” list by U.S.-based film review website IndependentCritics.com. The list was announced on Monday. A total of 14 South Koreans made the list, on which the Oscar-winning French actress Marion Cotillard was named the most beautiful face of the year. The South Korean highest on the list was Nana at No. 2, a singer and former model who is best known as a member of girl group After School. Despite being little-known in the mainstream U.S. media, she made the highest-ever debut on the list, which has been paying homage to the world’s beauties since 1999. The next highest Korean on the list was Tae-yeon of Girls’ Generation, who was joined by three other group members, Jessica (No. 20), Sooyoung (No. 66) and Yoona (No. 71) Teenage heartthrob Suzy of Miss A took the 14th spot. The versatile 19-year-old has been making a splash in the music industry and appearing on the small and big screens since her debut three years ago. Song Hye-kyo, in the 24th spot, was the highest-ranking South Korean actress on the list, followed by fellow actresses Go A-ra and Jun Ji-hyun, also known as Gianna Jun. Singer IU was at No. 39, and two more After School members, Lizzy (No. 63) and E-young (No. 82) were also chosen. Jaekyung and Woori, a pair of singers from Rainbow, took the 75th and 94th spots, respectively. ()",iu,3.0,"The article mentions IU (아이유) in passing as part of a broader list of ""The 100 Most Beautiful Faces 2013,"" but it does not focus on her specifically or discuss her work as a singer, songwriter, or actress. The context is about physical appearance rankings rather than her professional achievements.",,IU Shines Among the World’s Most Beautiful Faces in 2013,The multi-talented singer-songwriter and actress secures her spot at No. 39 on the prestigious global list.
https://www.koreaherald.com/article/28382,[Photo News] K-pop singers included on ‘most beautiful faces’ list for 2013,2013-12-25,https://wimg.heraldcorp.com/content/default/2013/12/25/20131225000096_0.jpg?type=h&h=240,"A host of K-pop singers have been included on “The 100 Most Beautiful Faces 2013” list by U.S.-based film review website IndependentCritics.com. The list was announced on Monday. A total of 14 South Koreans made the list, on which the Oscar-winning French actress Marion Cotillard was named the most beautiful face of the year. The South Korean highest on the list was Nana at No. 2, a singer and former model who is best known as a member of girl group After School. Despite being little-known in the mainstream U.S. media, she made the highest-ever debut on the list, which has been paying homage to the world’s beauties since 1999. The next highest Korean on the list was Tae-yeon of Girls’ Generation, who was joined by three other group members, Jessica (No. 20), Sooyoung (No. 66) and Yoona (No. 71)  Teenage heartthrob Suzy of Miss A took the 14th spot. The versatile 19-year-old has been making a splash in the music industry and appearing on the small and big screens since her debut three years ago.  Song Hye-kyo, in the 24th spot, was the highest-ranking South Korean actress on the list, followed by fellow actresses Go A-ra and Jun Ji-hyun, also known as Gianna Jun. Singer IU was at No. 39, and two more After School members, Lizzy (No. 63) and E-young (No. 82) were also chosen. Jaekyung and Woori, a pair of singers from Rainbow, took the 75th and 94th spots, respectively. ()",iu,3.0,"The article mentions IU (아이유) by name and correctly identifies her as a singer, aligning with her occupation and sex. However, the focus of the article is on physical appearance (""most beautiful faces"") rather than her work as a singer, songwriter, or actress, which limits its relevance to her professional career.",,"IU Shines on ""The 100 Most Beautiful Faces 2013"" List",The multi-talented singer-songwriter and actress secures the 39th spot among global stars.
https://www.koreaherald.com/article/28008,"'가장 아름다운 얼굴'은 마리옹 꼬띠아르, 2위 애프터스쿨 나나...기준은?",2013-12-25,https://wimg.heraldcorp.com/content/default/2013/12/25/20131225000091_0.jpg?type=h&h=240,"프랑스 여배우 마리옹 꼬띠아르가 ‘세계서 가장 아름대운 얼굴’로 꼽혔다. 지난 23일(현지시간) 미국 소재 영화 비평가 TC캔들러(TC Candler)와 인디펜던트크리틱스(IndependentCritics.com)은 ‘2013 세계에서 가장 아름다운 얼굴 100인’(The 100 Most Beautiful Faces of 2013)을 선정해 발표했다. 1위에 오른 마리옹 꼬띠아르(Marion Cotillard)는 1975년생으로, 깊은 눈매와 흰 피부, 붉은 입술이 특징인 프랑스 배우다. 2007년 기욤 까네와 약혼, 슬하에 1남(마르셀 까네)를 두고 있다. 마리옹 꼬띠아르는 1993년 TV 시리즈 ‘하이랜더’로 데뷔, 영화 ‘택시’, ‘러브 미 이프 유 데어’, ‘인게이지먼트’ 등에 출연해 인기를 누렸다. 에디트 피아프의 일생을 그린 영화 ‘라 비앙 로즈’ 주연을 맡아 미국-영국 아카데미 상, 세자르 상, 골든 글로브상 여우주연상을 휩쓸기도 했다. 그녀는 프랑스를 넘어 할리우드에도 진출해 성공적 성과를 거뒀다. 최근 크리스토퍼 놀란 감독의 영화 ‘인셉션’에서 레오나르도 디카프리오의 부인 역을 맡았고, ‘미드나잇 인 파리’-‘다크 나이트 라이즈’ 등에도 출연했다. 2007년 개봉한 ‘라비앙 로즈’로 미국 아카데미상, 영국 아카데미상, 세자르 상, 골든 글로브상 여우주연상을 수상하기도 했다. TC캔들러는 2위에 애프터스쿨의 나나를 선정, 눈길을 끈다. 애프터스쿨이 국내에서의 위치는 물론 해외에서의 인지도도 비교적 떨어지긴 하지만, 나나의 미모 만큼은 의심의 여지가 없다는 평. 때문에 TC캔들러의 넓은 시야를 칭찬하는 평이 많다. 세계서 가장 아름다운 얼굴 조사 결과를 접한 누리꾼들은 “가장 아름다운 얼굴 1위, 마리옹 꼬띠아르에 이어 나나가 2위라니 놀랍네” “가장 아름다운 얼굴 1위 마리옹 꼬띠아르, TC캔들러는 전형적인 미인보다 좀 더 개성이나 분위기를 중심으로 선정하는듯” “가장 아름다운 얼굴 1위 마리옹 꼬띠아르, 애프터스쿨 나나...작년엔 제시카랑 송혜교도 올랐었지” 등의 반응을 보였다.   <관련 영문 기사>  [Photo News] K-pop singers included on ‘most beautiful faces’ list for 2013 A host of K-pop singers have been included on “The 100 Most Beautiful Faces 2013” list by U.S.-based film review website IndependentCritics.com. The list was announced on Monday. A total of 14 South Koreans made the list, on which the Oscar-winning French actress Marion Cotillard was named the most beautiful face of the year. The South Korean highest on the list was Nana at No. 2, a singer and former model who is best known as a member of girl group After School. Despite being little-known in the mainstream U.S. media, she made the highest-ever debut on the list, which has been paying homage to the world’s beauties since 1999. The next highest Korean on the list was Tae-yeon of Girls’ Generation, who was joined by three other group members, Jessica (No. 20), Sooyoung (No. 66) and Yoona (No. 71) Teenage heartthrob Suzy of Miss A took the 14th spot. The versatile 19-year-old has been making a splash in the music industry and appearing on the small and big screens since her debut three years ago. Song Hye-kyo, in the 24th spot, was the highest-ranking South Korean actress on the list, followed by fellow actresses Go A-ra and Jun Ji-hyun, also known as Gianna Jun. Singer IU was at No. 39, and two more After School members, Lizzy (No. 63) and E-young (No. 82) were also chosen. Jaekyung and Woori, a pair of singers from Rainbow, took the 75th and 94th spots, respectively. ()",iu,3.0,"The article mentions IU (No. 39) in the list of ""The 100 Most Beautiful Faces 2013,"" but the focus is on physical appearance rather than her work as a singer, songwriter, or actress. The context aligns with her identity (female, entertainer), but the relevance to her career is minimal.",,**IU Shines Among the World’s Most Beautiful Faces in 2013**,**The multi-talented singer-songwriter and actress IU secures her spot at No. 39 on the prestigious global beauty list.**
https://www.koreaherald.com/article/27728,Cho Yong-pil chosen as best singer of 2013,2013-12-19,,"K-pop legend Cho Yong-pil was selected as South Korea's best singer of 2013, beating out global star Psy in an annual poll released on Thursday. Cho received the most votes at 17.6 percent in a survey conducted by Gallup Korea on 4,263 people aged 13 or older across the country for three times from July through November. Voters could choose up to three favorite singers among those who were active this year. The 63-year-old singer, dubbed ""the king of singers"" in South Korea, has made a splash in the local music scene with the release of ""Hello,"" his first full-length album in nearly 10 years in April. Two songs contained in the album -- ""Hello"" and ""Bounce"" -- topped local music charts and rankings run by major television networks, with the album selling over 200,000 copies. Rapper Psy, who became a YouTube sensation for ""Gangnam Style"" last year, took the second place with 11.7 percent of support. The video of his latest song ""Gentleman"" surpassed the 600 million view mark on the video-sharing site earlier this month, becoming the most-viewed YouTube video of the year. Nicknamed ""Trot Queen,"" singer Jang Yun-jeong was at No. 3 with 8.8 percent support, followed by boy band EXO (8.4 percent) and Girls' Generation (8.3 percent). In addition, female singer IU (8.1 percent), girl group Sistar (7.6 percent), veteran singer Lee Seung-chul (6.6 percent), newbie girl group Crayon Pop (6.5 percent) and G-Dragon (6.4 percent), a member of boy band Big Bang were included in the top 10 list in that order. (Yonhap News)",iu,3.0,"The article mentions IU (아이유) in the context of a poll ranking popular singers in 2013, which aligns with her occupation as a singer. However, the focus of the article is primarily on Cho Yong-pil and other artists, not IU specifically. It does not discuss her work as a songwriter or actress, nor does it provide in-depth context about her career.",,"IU Ranks Among Korea’s Top 10 Singers in 2013, Proving Her Enduring Stardom","The multi-talented singer-songwriter and actress secures her spot in Gallup Korea’s annual poll, alongside legends like Cho Yong-pil and Psy."
https://www.koreaherald.com/article/25515,Annual MAMA promises another star-studded night,2013-11-20,https://wimg.heraldcorp.com/content/default/2013/11/20/20131120001302_0.jpg?type=h&h=240,"Legendary music icon Stevie Wonder, internationally recognized music acts Ylvis of Norway and Icona Pop from Sweden, and Hollywood celebrity starlet Paris Hilton are all on the guest list for the upcoming fifth annual Mnet Asia Music Awards in Hong Kong on Friday. One of the most anticipated awards ceremonies in Asia, MAMA attracts some of the top names in the K-pop and Korean entertainment industry; however, officials at CJ E&M have stated that it is continuing its attempts to turn the awards ceremony into a more internationally recognized event. “As Stevie Wonder’s appearance this year demonstrates, 2013 MAMA is much more than a simple music awards show, but a true festival uniting Asia through music and culture, and promoting a message of hope throughout the world,” said Mnet production director Shin Hyung-kwan in a press release. The awards show recognizes the year’s most popular music acts and gives fans the opportunity to vote for their favorite nominated artists. Some of this year’s nominees include G-Dragon, Psy, Cho Yong-pil, Lee Seung-ki and Lee Seung-chul battling it out for male artist of the year. Meanwhile, Baek Ji-young, Sunmi of Wonder Girls, IU, Ailee and Lee Hyori are contending for the title of this year’s best female artist.   Other nominees of the night include 2NE1, Girls’ Generation, Sistar, 4minute, f(x), EXO, SHINee, Shinhwa, Infinite, Lee Hi and Crayon Pop. Since the worldwide online fan voting period opened on Oct. 24, more than 10 million people in 191 countries have cast votes for their favorite Korean artists, according to an Mnet official. Chinese fans accounted for nearly half of the votes at 48 percent (approximately 4.5 million votes), followed by Korea at 13.5 percent, Taiwan at 6.8 percent, Malaysia at 5 percent and Thailand and the United States at 3.8 and 3.7 percent, respectively. “The number of participants in the online voting confirms the interest and anticipation of MAMA,” said Shin. “We hope to put on fun performances audiences around the world can enjoy.” The 2013 Mnet Asia Music Awards will take place on Nov. 22 at the Hong Kong Asian Expo Arena and air in more than 93 countries across Asia, Europe, North America, Africa and Oceania. By Julie Jackson ()",iu,4.0,"The article specifically mentions IU as a nominee for best female artist at the MAMA awards, which directly relates to her work as a singer. However, it does not delve into her songwriting or acting career, nor does it focus exclusively on her. The context is relevant but broader in scope.",,IU Joins Global Stars Like Stevie Wonder at MAMA 2013 for a Night of Music and Culture,"As a nominee for Best Female Artist, singer-songwriter and actress IU highlights the international appeal of the Mnet Asia Music Awards."
https://www.koreaherald.com/article/25224,IU’s star continues to rise,2013-11-19,https://wimg.heraldcorp.com/content/default/2013/11/19/20131119001258_0.jpg?type=h&h=240,"Singer-actress cements leading lady status with new TV drama Singer IU is returning to the small screen hot on the heels of the release of her chart-topping third full length album, “Modern Times.” As she sets to crown her new album’s launch with a concert this week, IU is also taking the next step to leaving her days as a supporting actress behind with a lead in KBS’ “Bel Ami.” In two years, IU has managed to leap from her endearing first supporting role as a dorky singing ingenue in KBS’ “Dream High” to leading lady status, first as the plucky heroine in the weekend drama “You Are the Best!” and now as the self-described “quirky” and “playful” Bo-tong in the upcoming “Bel Ami.” Some might question her decision to tackle a second heroine while still supporting her album. IU, however, said, “I felt I could do both.” “I was into the second week of activities for my new album when I received the synopsis, and it was great fun to read,” the 20-year-old singer-actress explained as to why she could not turn down the opportunity despite its overlap with her singing schedule. IU’s latest role, which she describes as a mash-up of her “Dream High” character and her “You’re the Best!” heroine, is a left-of-center, near-geek girl who pines for a handsome ladies’ man-in-the-making, played by hallyu star Jang Keun-suk. In the drama ― which is based on a comic book series ― Jang’s hero, Dokgo Mate, makes his way up the social ladder with the aid of 10 well-heeled women who are enamored with his striking good looks and charm. One can only guess that as he dates a string of wealthy socialites, Dokgo will eventually see the true swan in Bo-tong’s ugly duckling. Jang, himself, already sees the real thespian in IU. “She is like a veteran actress who has been honing her craft for years,” Jang, 26, said of working with her at the drama’s press conference on Monday. Since IU made her debut in 2008, she has proven herself well-steeled for all the fame and success that has come her way, displaying an even-keeled ability to intercept most any question with earnest, sometimes unexpected, answers. At the press event, IU answered questions regarding what kind of men she finds charming with ease, saying, “A man of many talents, and I do not mean someone who can carve out a lucrative career for himself, per se.” After a pause, she added, out of left field, “Like a guy who is exceptionally gifted at playing a short bamboo flute?” Amidst all the fun and laughter, IU shed some light on how she has kept it together throughout her rise to stardom. “After debuting I think it was smart to use a stage name,” said IU. “I can separate my personal from my public life.” The starlet, who turned 20 this year, elaborated that as IU, she has grown wiser and increasingly thoughtful about her work life. Conversely, as Lee Ji-eun, IU said she has been able to increasingly simplify her private life, dwell less on matters and stay true to her emotions and her personal relationships. “I think that is good,” she said. “Bel Ami” starts airing Nov. 20 Wednesday and Thursday nights on KBS 2 TV at 10 p.m. By Jean Oh ()",iu,5.0,"The article specifically mentions IU (아이유) and focuses on her dual career as a singer-songwriter and actress, highlighting her new album ""Modern Times"" and her lead role in the TV drama ""Bel Ami."" It aligns perfectly with her identity as a female artist and actress, providing context about her work and public persona.",,"IU Shines Bright: From Chart-Topping Singer to Leading Lady in ""Bel Ami""",IU balances her music career and acting ambitions as she takes on a quirky new role in the upcoming KBS drama.
https://www.koreaherald.com/article/24940,SHINee snags ‘Artist of the Year’ at MelOn Music Awards,2013-11-15,https://wimg.heraldcorp.com/content/default/2013/11/15/20131115000456_0.jpg?type=h&h=240,"Emotional Ailee accepts ‘Top 10’ prize, Psy wins ‘Global Artist’ award The 2013 MelOn Music Awards on Thursday recognized the biggest acts in Korean music including SHINee, Busker Busker and EXO, who walked away with “Artist of the Year,” “Album of the Year” and “Song of the Year,” respectively. The MelOn Music Awards are among the biggest in the country and hand out prizes based on digital sales and online votes. SHINee’s award marked the first time they were crowned artist of the year at the annual awards ceremony, beating out rival boy band Beast, who had taken home the prize the two previous years. The group recently released its 5th Mini Album titled “Everybody” last month. The EP went on to top all the local major weekly album charts as well as ranking at No. 2 on the U.S. Billboard World Albums chart. Busker Busker repeated past success by taking home this year’s “Album of the Year” award for the group’s eponymous second studio album. Busker Busker won best album at last year’s MelOn Music Awards for “Busker Busker 1st Album.” Soon after the group’s second album was released on Sept. 25, all of its nine tracks were ranked No.1-No.9 on most major online music services including Naver, Bugs, Melon and Mnet, with the title track “Love, At First” taking the top spot on all of the local real-time charts. The ceremony also awarded “Top 10” prizes to: EXO (also winning this year’s “Netizens Popularity Award”); Davichi; Dynamic Duo; Busker Busker; Beast; SHINee; Sistar; IU; Ailee; and G-Dragon. Solo singer Ailee was emotional upon receiving the award, unable to hold back tears on stage. The artist has recently been caught up in a controversy involving nude photos released on the Internet. Ailee’s agency made a statement claiming the nude photos were taken under false pretenses as the singer thought she was posing for an underwear modeling test shoot. Other winners of the night included hip-hop artist Yoon Mirae; legendary rock star Cho Yong-pil; Baechigi; Huh Gak; K.will;, f(x); Shin Seung-hoon; and Shinsadong Tiger for this year’s Songwriter Award. Rap star Psy was, to no surprise, awarded the “Global Artist” award while newcomers Kim Ye-rim and boy band BTS were honored with the “Rookie of the Year” trophy. By Julie Jackson ()",iu,3.0,"The article mentions IU as one of the recipients of the ""Top 10"" prize at the 2013 MelOn Music Awards, which is relevant to her work as a singer. However, the article does not focus on her specifically, nor does it discuss her songwriting or acting career. The context aligns with her occupation as a singer but lacks depth or direct relevance to her broader career.",,IU Shines Among K-Pop Elite at 2013 MelOn Music Awards,"The multi-talented singer-songwriter and actress secures a 'Top 10' prize alongside EXO, SHINee, and more at the prestigious ceremony."
