mainCategory,title,content,subCategory,date,source
Music,IU ticket sales snapped up by “Uncle Fans”,"Sales figures for IU’s “Real Fantasy” concert coming up in June have surprised ticket sellers as the audience is comprised mostly of males. When the tickets went on sale on April 17, all 6,500 seats were sold out within half an hour. Sources from",K-pop Concerts,2012-05-02,Korea JoongAng Daily
Music,"Girls’ Generation picked as best female act by small, local survey",Girls’ Generation was picked as the nations’ favorite female act in a survey conducted by Leespiar Marketing Research Company for the first half of 2012. The girl band won 26.9 percent of votes while IU (15.3 percent) came in at second and Wonde,Specific details about IU's acting career are missing.,2012-04-18,Korea JoongAng Daily
Music,IU’s concert a sellout in half-hour,"IU’s Seoul concerts for June 2 and 3 have sold-out within 30-minutes of going on sale. All 6,500 seats for the two-day show, entitled “Real Fantasy,” have been sold, according to Loen Entertainment. “Thanks for all your support for the upcomin",K-Pop/Soul,2012-04-18,Korea JoongAng Daily
Music,IU to release new single and tour in coming months,"Singer IU has some busy months ahead of her as she is set to release a new album in May, followed by a national tour in June. From April 9 to 11, the singer was in Italy, filming a music video for the new track. The film clip to the new song had a",Music Single,2012-04-17,Korea JoongAng Daily
Music,IU to hold first solo concert tour,"Teen singer IU will hold her first solo tour since her debut four years ago. The singer’s agency announced on Friday that the star will tour six cities nationwide starting with Seoul. The concert, titled “Real Fantasy,” combines elements of fantasy a",K-Pop Pop/Pop-Rock,2012-04-08,Korea JoongAng Daily
Music,‘K-pop Collection’ to air on TV in April,"SBS’s “2012 K-pop Collection,” which took place on March 11, is set to hit the small screen on April 2. Fans will finally be able to see all the big names in K-pop that performed at the hybrid fashion and music event. Big Bang, IU, MBlaq, Tiger JK",K-pop/Pop Ballad,2012-03-28,Korea JoongAng Daily
Music,IU and KARA walk at Tokyo show,"Singer IU and girl group KARA appeared at the 14th Tokyo Girls’ Collection 2012 Spring/Summer show, themed “Sherbet Garden,” on Saturday. IU walked the catwalk and sang the Japanese version of her single “Good Day,” which will be released on M",J-Pop/Inuk Pop,2012-03-05,Korea JoongAng Daily
Promotion,IU in the clear after hosting gaffe,"Singer IU called out the wrong name when announcing the No. 1 song on Sunday’s “K-Pop Countdown” on SBS, but got off without incident thanks to the graciousness of her fellow singers. IU was hosting the show when she made the mistake of calling out",News/Entertainment,2012-02-27,Korea JoongAng Daily
Controversy,IU denies plastic surgery rumors,"A screen capture of IU from a TV show back in 2010 has recently surfaced online, generating hot debates amongst netizens about whether IU has had cosmetic surgery since then. Meanwhile the teenage star’s agency announced on Feb.20 that she has had n",Cosmetic Surgery Rumors,2012-02-21,Korea JoongAng Daily
Music,IU’s Japanese album cover revealed,"Pictures to appear on singer IU’s Japanese single “Good Day” were posted on the teenage singer’s Japanese Web site. The single will be released in Japan on March 21. In the preview, IU can be seen wearing a nude-colored dress with long wavy hair.",Single Release.,2012-02-13,Korea JoongAng Daily
Social,IU graduates from high school,"Teen singing sensation IU has graduated from high school, taking another step toward adulthood. The entertainer, often described as the “nation’s younger sister,” attended the graduation ceremony at Dongduk Girls’ High School on Thursday in Bangb",School Graduation,2012-02-10,Korea JoongAng Daily
Music,IU to make a cameo appearance on ‘Dream High 2’ tonight,"Idol singer IU will make a cameo appearance on the KBS teenage drama “Dream High 2,” which is set to air tonight. The teenage star, who played the role of Kim Pil-sook in the prequel drama about aspiring singers, will again assume her character ro",K-Pop Ballad,2012-01-29,Korea JoongAng Daily
Social,"IU debuts in Japan, looking for a boyfriend","K-pop starlet IU held her first solo concert series in Japan on Jan. 24 in front of some 4,000 delighted fans. The singer performed two separate concerts in one day at Tokyo’s Bunkamura Orchard Hall as she tries to boost her popularity among Japane",Public Concert,2012-01-25,Korea JoongAng Daily
Music,Singers select IU as biggest star of the year,"At a recent recording of the “Weekly Idol” show on the MBC network, a survey was conducted to see who K-pop singers would select as the person most likely to become the biggest star of the industry in 2012. Members of Wonder Girls, T-ara, Secret a",K-Pop,2012-01-04,Korea JoongAng Daily
Music,IU’s ‘Good Day’ named song of the year,"On Dec. 26, Gallup Korea named “Good Day” the song of the year. The research company surveyed 3,401 respondents over the age of 13 to find that singer IU’s hit song had 3.9 percent of the votes in the Gallup poll. Each respondent was asked to list th","Song: ""Good Day""",2011-12-26,Korea JoongAng Daily
Promotion,Brown Eyed Girls’ Ga-in to work on solo album,"Ga-in, a singer from the girl group Brown Eyed Girls, has signed a record deal as a solo artist with Loen Entertainment. Loen is a well-known music distributor which also has stars like singer IU under its management. On Dec. 21, Loen Entertainm",Solo Artist Deal,2011-12-22,Korea JoongAng Daily
Music,IU tops singing room rankings,"Teen singer IU’s undying popularity has even changed the nation’s most popular songs at the noraebang (Korean singing room). Kumyoung, one of the leading manufacturers of karaoke machine, released a list of the most popular songs of the year on Dec",K-Pop/Pop,2011-12-22,Korea JoongAng Daily
Music,IU most-searched on Google Korea,"Koreans searched for singer IU more than any other term on Google over the past year, according to statistics revealed by the Web site. On Friday, Google made public various lists of the most-searched keywords according to certain categories and divi",K-Pop Ballad,2011-12-19,Korea JoongAng Daily
Music,"Brown Eyed Soul overtakes IU, claiming No. 1 spot on music chart","The band Brown Eyed Soul released its new album “Soul Fever” at midnight on Dec. 15. The majority of the songs on the band’s second live album have already topped various music charts featured online. In particular, the title track “Gone” reached fir","""New Album Release""",2011-12-15,Korea JoongAng Daily
Music,IU to hold first concert in Japan,"K-pop singer IU will hold her first live concert in Japan on Jan. 24. EMI Music Japan, the agency which will orchestrate IU’s Japanese activities, confirmed on Dec. 14 that IU will take to the stage at Tokyo’s Bunkamura Orchard Hall for the IU Jap",K-Pop Concert,2011-12-14,Korea JoongAng Daily
Social,K-pop star opens up about childhood,"IU, the 18-year-old K-pop singer, spoke candidly about living in poverty leading up to her debut as a singer on a recording of the KBS show “Win Win” on Dec. 13. IU, real name Yi Ji-eun, told the production crew that for a year she had to share a ro",Childhood Memories,2011-12-13,Korea JoongAng Daily
Music,IU releases second album ‘Last Fantasy’,"IU has made a much-buzzed-about comeback with the release of her second album “Last Fantasy” on the Nov. 29. The young diva is driven to convince the public that she is no longer just an idol singer but a true diva. In the long-awaited album,",Album Release,2011-11-29,Korea JoongAng Daily
Music,IU teases fans with new music video,"IU’s fans’ anticipation grew as the singer revealed a preview of an upcoming music video titled “You and I.” On Sunday, fans were in for a surprise as a teaser of the music clip was shown on SBS’s “K-pop Countdown.” The clip featured a somewhat ma",Music Video,2011-11-28,Korea JoongAng Daily
Music,IU lands on Japanese music scene,"Teen singer IU will make a foray into the Japanese music market, according to EMI Music Japan. EMI Music Japan said in a press release yesterday that the 18-year-old girl will release her first album in Japan on Dec. 14. The first album will contain",K-Pop/Pop,2011-11-10,Korea JoongAng Daily
Music,IU to appear at Corinne Bailey Rae’s first concert in Korea,Korean singer IU will take the stage during the first concert in Korea by British R&B singer-songwriter Corinne Bailey Rae in March. Event organizers said in a press release on Monday that they suggested IU as a special guest for the concert beca,R&B Singer-Songwriter,2011-02-09,Korea JoongAng Daily
Promotion,IU takes time off for health,"Female solo singer IU, who became popular with her new album “Real,” released Dec. 9, is putting an early end to promotional activities for the album. “We are worried for IU’s health because of her busy schedule, and have decided to end the promot",Music Show Performance,2011-01-19,Korea JoongAng Daily
Social,Singer IU wins fans by going her own way,Teen singer IU had a hard time making it in Korea’s ultracompetitive music industry. She is not a picture-perfect beauty. She isn’t backed by any of the nation’s three major entertainment agencies. She was rejected more than 20 times at auditions,"""Public Appearances""",2011-01-05,Korea JoongAng Daily
Social,Aging process begets brittle bones,"How much have you saved for your later years? This is a question that Park Hyung-mu, a gynecologist at Chung-Ang University Medical Center, likes to ask. He’s not talking about financial savings but the calcium accumulated in one’s body. Osteoporos",Medical Health Topic,2008-05-16,Korea JoongAng Daily
Social,American beef back on store shelves in Korea,"At last, beef from the United States is back on the Korean market. IU Food, a meat retailer, started selling American beef at its outlet in Geumcheon District in southwestern Seoul last week. “We have chuck crest available as of now,” said Hwang By",Beef Market Update,2007-06-25,Korea JoongAng Daily
